iPhone	Obamacare is a disaster. Rates going through the sky - ready to explode. I will fix it. Hillary can't! #ObamacareFailed
iPhone	Truly honored to receive the first ever presidential endorsement from the Bay of Pigs Veterans Association. #MAGA… _URL_
iPhone	Obamacare is a disaster - as I've been saying from the beginning. Time to repeal & replace! #ObamacareFail _URL_
iPhone	#ObamacareFail _URL_
iPhone	Obamacare is a disaster! Time to repeal & replace! #ObamacareFail _URL_
iPhone	#ObamacareFail _URL_
iPhone	Get out and vote! I am your voice and I will fight for you! We will make America great again! _URL_
iPhone	Key Obamacare premiums to jump 25% next year: _URL_
iPhone	#Obamacare premiums are about to SKYROCKET --- again. Crooked H will only make it worse. We will repeal & replace! _URL_
iPhone	As election looms, some bad news for Clinton, Democrats: _URL_
iPhone	Record crowd in Tampa, Florida- thank you! We will WIN FLORIDA, #DrainTheSwamp in Washington D.C. and MAKE AMERICA… _URL_
iPhone	Thank you Bobby Bowden for the intro tonight and your support! I hope I can do as well for Florida as you have done! _URL_
iPhone	My contract with the American voter will restore honesty, accountability & CHANGE to Washington! #DrainTheSwamp _URL_
iPhone	Peter Navarro: 'Trump the Bull vs. Clinton the Bear' #DrainTheSwamp _URL_
iPhone	'Democratic operative caught on camera: Hillary PERSONALLY ordered 'Donald Duck' troll campaign that broke the law' _URL_
iPhone	Join me tomorrow in Sanford or Tallahassee, Florida! Sanford at 3pm: _URL_ Tallahassee at 6pm: _URL_
iPhone	THANK YOU St. Augustine, Florida! Get out and VOTE! Join the MOVEMENT - and lets #DrainTheSwamp! Off to Tampa now!… _URL_
iPhone	Join me LIVE on my Facebook page in St. Augustine, Florida! Lets #DrainTheSwamp & MAKE AMERICA GREAT AGAIN!… _URL_
iPhone	Honored to receive an endorsement from _USERNAME_ - thank you! Together, we are going to MAKE AMERICA SAFE & GREAT AG… _URL_
iPhone	'Hillary Clinton Had Gun Control Supporters Planted In Town Hall Audience' _URL_
iPhone	'The Clinton Foundation’s Most Questionable Foreign Donations' #PayToPlay #DrainTheSwamp _URL_
iPhone	Departing Farmers Round Table in Boynton Beach, Florida. Get out & VOTE- lets #MAGA! EARLY VOTING BY FL. COUNTY:… _URL_
iPhone	Get out to VOTE on 11/8/2016- and we will #DrainTheSwamp! RASMUSSEN NATIONAL Trump 43% Clinton 41% _URL_
iPhone	We are winning and the press is refusing to report it. Don't let them fool you- get out and vote! #DrainTheSwamp on November 8th!
iPhone	Why has nobody asked Kaine about the horrible views emanated on WikiLeaks about Catholics? Media in the tank for Clinton but Trump will win!
Android	Major story that the Dems are making up phony polls in order to suppress the the Trump . We are going to WIN!
Android	Wow, just came out on secret tape that Crooked Hillary wants to take in as many Syrians as possible. We cannot let this happen - ISIS!
iPhone	'Clinton Ally Aided Campaign of FBI Official’s Wife' _URL_
iPhone	'Clinton Charity Got Up To $56 Million From Nations That Are Anti-Women, Gays' #CrookedHillary _URL_
iPhone	Thank you Naples, Florida! Get out and VOTE #TrumpPence16 on 11/8. Lets #MakeAmericaGreatAgain! Full Naples rally… _URL_
Android	The attack on Mosul is turning out to be a total disaster. We gave them months of notice. U.S. is looking so dumb. VOTE TRUMP and WIN AGAIN!
iPhone	#CrookedHillary #PayToPlay _URL_
iPhone	Join me in Naples, Florida this evening at 6:00pm! Tickets: _URL_ _URL_
iPhone	Remember - get out on November 8th & VOTE #TrumpPence16. It is time to #DrainTheSwamp -- this is our last chance! _URL_
iPhone	Thank you Las Vegas Review Journal! EDITORIAL: 'Donald Trump for president' _URL_ via _USERNAME_
Android	Well, Iran has done it again. Taken two of our people and asking for a fortune for their release. This doesn't happen if I'm president!
Android	'If you can't run your own house you certainly can't run the White House' A statement made by Mrs. Obama about Crooked Hillary Clinton
iPhone	Thank you for the massive turnout tonight- Cleveland, Ohio! Get out & VOTE #TrumpPence16 on 11/8. Watch rally here:… _URL_
iPhone	WikiLeaks: 'Clinton-Kaine Even Lied About Timing of Veep Pick' _URL_
iPhone	'Trump lays out policies for first 100 days in White House' _URL_
iPhone	'Huma Abedin told Clinton her secret email account caused problems' _URL_
iPhone	Just arrived in Cleveland, Ohio- join Governor _USERNAME_ and I now, LIVE via: _URL_
iPhone	Hillary Clinton: 'Architect of failure' #DrainTheSwamp #CrookedHillary _URL_
iPhone	Unbelievable crowd of supporters in Virginia Beach, Virginia. Thank you! Next stop - Cleveland, Ohio.… _URL_
iPhone	In order to #DrainTheSwamp & create a new GOVERNMENT of, by, & for the PEOPLE, I need your VOTE! Go to _URL_ LET'S #MAGA!
iPhone	Today I introduced my Contract with the American Voter - our economy will be STRONG & our people will be SAFE.… _URL_
iPhone	Change has to come from outside our very broken system. #MAGA _URL_
iPhone	Crooked Hillary Clinton Tops Middle East Forum’s ‘Islamist Money List' _URL_
iPhone	Landing in Pennsylvania now. Great new poll this morning, thank you. Lets #DrainTheSwamp and #MakeAmericaGreatAgain… _URL_
iPhone	Will be in Cleveland, Ohio w/ _USERNAME_ tonight- join us: _URL_ Naples, Florida-tomorrow @ 6pm: _URL_
Android	'_USERNAME_ I #Voted for DonaldTrump! #Arizona ☉ #Economy #Immigration #Jobs #Veterans #BorderControl #Trade… _URL_
Android	'_USERNAME_ Best way to pay Hillary back for what she did to _USERNAME_ #DNCleak is a DonaldTrump LANDSLIDE _URL_
Android	The media refuses to talk about the three new national polls that have me in first place. Biggest crowds ever - watch what happens!
Android	Just returned from Pennsylvania where we will be bringing back their jobs. Amazing crowd. Will be going back tomorrow, to Gettysburg!
iPhone	Governor _USERNAME_ and I will be in Cleveland, Ohio tomorrow night at 7pm - join us! #MAGA Tickets:… _URL_
iPhone	Thank you to the great crowd of supporters in Newtown, Pennsylvania. Get out & VOTE on 11/8/16. Lets #MAGA! Watch:… _URL_
iPhone	#CrookedHillary sending U.S. intelligence info. to Podesta’s hacked email is ‘unquestionably an OPSEC violation’ _URL_
iPhone	WikiLeaks reveals Clinton camp’s work with ‘VERY friendly and malleable reporters’ #DrainTheSwamp #CrookedHillary _URL_
iPhone	Donna Brazile Shreds Obama Economy - Acting DNC chair says 'people are more in despair about how things are' _URL_
iPhone	'{Crooked Hillary Clinton} created this mess, and she knows it.' #DrainTheSwamp _URL_ _URL_
iPhone	'Clinton Campaign And Harry Reid Worked With New York Times To Smear State Dept Watchdog' Time to #DrainTheSwamp! _URL_
iPhone	VERY IRONIC: 'In 2010 video, Clinton lectured underlings on cybersecurity and guarding ‘sensitive information’' _URL_
iPhone	A top Clinton Foundation official said he could name “500 different examples” of conflicts of interest. _URL_
iPhone	#CrookedHillary “was at center of negotiating $12M commitment from King Mohammed VI of Morocco” to Clinton Fdn. _URL_
iPhone	Great crowd in Fletcher, North Carolina- thank you! Heading to Johnstown, Pennsylvania now! Get out on November 8th… _URL_
Android	The results are in on the final debate and it is almost unanimous, I WON! Thank you, these are very exciting times.
iPhone	Huma calls it a 'MESS,' the rest of us call it CORRUPT! WikiLeaks catches Crooked in the act - again. #DrainTheSwamp _URL_
iPhone	Hillary & Obama's Broken Promises. #RepealObamacare _URL_
iPhone	In addition to those without health coverage- those that have disastrous #Obamacare are seeing MASSIVE PREMIUM INCR… _URL_
iPhone	Crooked Hillary promised 200k jobs in NY and FAILED. We'll create 25M jobs when I'm president, and I will DELIVER! _URL_
iPhone	Crooked took MILLIONS from oppressive ME countries. Will she give the $$$ back? Probably not. Don't forget her slog… _URL_
iPhone	'Trump won the third debate' _URL_
iPhone	UPCOMING RALLIES - JOIN ME! TOMORROW Fletcher, NC @ 12pm. _URL_ SATURDAY Cleveland, OH @ 7pm. _URL_
iPhone	#ICYMI - OHIO RALLY! Watch here: _URL_ _URL_
iPhone	Want access to Crooked Hillary? Don't forget - it's going to cost you! #DrainTheSwamp #PayToPlay _URL_
iPhone	Thank you Delaware County, Ohio! Remember- either we WIN this election, or we are going to LOSE this country!… _URL_
Android	Why didn't Hillary Clinton announce that she was inappropriately given the debate questions - she secretly used them! Crooked Hillary.
iPhone	Thank you America! #MAGA Rasmussen National Poll Donald Trump 43% Hillary Clinton 40% _URL_
iPhone	Just landed in Ohio. Thank you America- I am honored to win the final debate for our MOVEMENT. It is time to… _URL_
iPhone	Totally dishonest Donna Brazile chokes on the truth. Highly illegal! Watch: _URL_ _URL_
iPhone	The Washington Times Presidential Debate Poll: TRUMP 77% (18,290) CLINTON 17% (4,100) #DrainTheSwamp #Debate _URL_
iPhone	Join the MOVEMENT to #MAGA! _URL_ _URL_
iPhone	Great poll - thank you America! Once we #DrainTheSwamp, together we will #MAGA🇺🇸#Debate _URL_
Android	That was really exciting. Made all of my points. MAKE AMERICA GREAT AGAIN!
iPhone	Join my team over on my Facebook page- live now! #Debates _URL_ _URL_
iPhone	The era of division is coming to an end. We will create a new future of #AmericanUnity. First, we need to… _URL_
iPhone	HILLARY'S HEALTH CARE POLICIES #DrainTheSwamp #Debate _URL_
iPhone	We have to repeal & replace #Obamacare! Look at what is doing to people! #DrainTheSwamp _URL_
iPhone	The economy cannot take four more years of these same failed policies. #BigLeagueTruth #DrainTheSwamp _URL_
iPhone	Together we can save American JOBS, American LIVES, and AMERICAN FUTURES! #Debates _URL_
iPhone	#BigLeagueTruth #DrainTheSwamp _URL_
iPhone	HILLARY FAILED ALL OVER THE WORLD. #BigLeagueTruth ❌LIBYA ❌SYRIA ❌IRAN ❌IRAQ ❌ASIA PIVOT ❌RUSSIAN RESET ❌BENGHAZI… _URL_
iPhone	Hillary says 'take back Mosul?' We would have NEVER lost Mosul- if it wasn't for #CrookedHillary. #DrainTheSwamp _URL_
iPhone	You should give the money back _USERNAME_ #DrainTheSwamp _URL_
iPhone	I will do more in the first 30 days in office than Hillary has done in the last 30 years! #Debate  #BigLeagueTruth _URL_
iPhone	Brought to you by _USERNAME_ & her campaign- in Chicago, Illinois. #BigLeagueTruth #DrainTheSwamp _URL_
iPhone	._USERNAME_ has been doing this for THIRTY YEARS....where has she been? #BigLeagueTruth
iPhone	#CrookedHillary gives Obama an “A” for an economic recovery that’s the slowest since WWII... #BigLeagueTruth… _URL_
iPhone	THE CHOICE IS CLEAR! #BigLeagueTruth #DrainTheSwamp _URL_
iPhone	This is what we can expect from #CrookedHillary. More Taxes. More Spending. #BigLeageTruth #DrainTheSwamp #Debates _URL_
iPhone	._USERNAME_ talking about jobs? Remember what she promised upstate New York. #BigLeagueTruth #Debates _URL_
iPhone	._USERNAME_ you have failed, failed, and failed. #BigLeagueTruth Time to #DrainTheSwamp! _URL_
iPhone	Hey _USERNAME_ - WE AGREE! #BigLeagueTruth #DrainTheSwamp _URL_
iPhone	Plain & Simple: We should only admit into this country those who share our VALUES and RESPECT our people. _URL_
iPhone	#SecondAmendment #2A #Debates _URL_
iPhone	It is so imperative that we have the right justices. #DrainTheSwamp #Debates #BigLeagueTruth _URL_
iPhone	This is an incredible MOVEMENT- WE are going to take our country BACK! #November8th #BigLeagueTruth #Debate _URL_
iPhone	I will be handing over my Twitter account to my team of deplorables for tonight's #debate #MakeAmericaGreatAgain
iPhone	UNBELIEVABLE! Clinton campaign contractor caught in voter-fraud video is a felon who visited White House 342 times: _URL_
iPhone	'Over 250,000 to Lose Health Insurance in Battleground North Carolina Due to #Obamacare' _URL_
iPhone	Join my team tonight at 8:30pmE! _URL_ _URL_
iPhone	I will issue a lifetime ban against senior executive branch officials lobbying on behalf of a FOREIGN GOVERNMENT!… _URL_
iPhone	I am going to expand the definition of LOBBYIST - so we close all the LOOPHOLES! #DrainTheSwamp _URL_
iPhone	Obamacare premiums increasing 33% in Pennsylvania - a complete disaster. It must be repealed and replaced!… _URL_
iPhone	'Hillary Clinton Deleted Emails With Her Email Server Technician' _URL_
iPhone	Join me in Delaware, Ohio tomorrow at 12:30pm! #DrainTheSwamp Tickets: _URL_ _URL_
iPhone	'Top Hillary Adviser Mocked, Plotted Attacks on Pro-Sanders Civil Rights Leader' #DrainTheSwamp _URL_
iPhone	'Dem Operative Who Oversaw Trump Rally Agitators Visited White House 342 Times' #DrainTheSwamp _URL_
iPhone	'Scandals surround Clinton's gatekeeper at State' #DrainTheSwamp _URL_
iPhone	The State Department's 'shadow government' #DrainTheSwamp _URL_
iPhone	More Anti-Catholic Emails From Team Clinton: _URL_ _URL_
iPhone	It is time to #DrainTheSwamp! _URL_
iPhone	‘Food Groups’ – Emails Show Clinton Campaign Organized Potential VPs By Race And Gender: _URL_
iPhone	#DrainTheSwamp _URL_
iPhone	Time to #DrainTheSwamp in Washington, D.C. and VOTE #TrumpPence16 on 11/8/2016. Together, we will MAKE AMERICA SAFE… _URL_
iPhone	Hillary is the most corrupt person to ever run for the presidency of the United States. #DrainTheSwamp _URL_
iPhone	'Clinton Campaign Tried to Limit Damage From Classified Info on Email Server' #DrainTheSwamp _URL_
iPhone	'Trump rally disrupter was once on Clinton's payroll' _URL_
iPhone	Thank you Colorado Springs. If I’m elected President I am going to keep Radical Islamic Terrorists out of our count… _URL_
iPhone	FL, KS, ME, MD, MN, NJ, OR & WV! It's the LAST DAY to mail in voter reg forms. Get the forms at… _URL_
iPhone	Hillary’s Aides Urged Her to Take Foreign Lobbyist Donation And Deal With Attacks: _URL_
iPhone	If we let Crooked run the govt, history will remember 2017 as the year America lost its independence. #DrainTheSwamp _URL_
iPhone	I will Make Our Government Honest Again -- believe me. But first, I'm going to have to #DrainTheSwamp in DC. _URL_
Android	'_USERNAME_ 41% of American voters believe the election could be 'stolen' from DonaldTrump due to widespread voter fraud. - Politico'
iPhone	Great night in WI. I’m going to fight for every person in this country who believes government should serve the PEO… _URL_
iPhone	Donald J. Trump Ethics Reform Plan For Washington D.C. _URL_
iPhone	EXCLUSIVE: FBI Agents Say Comey ‘Stood In The Way’ Of Clinton Email Investigation: _URL_
iPhone	Get rich quick! Crooked Hillary Clinton's pay to play guide: _URL_
iPhone	Yet more evidence of a media-rigged election: _URL_
iPhone	My wife, Melania, will be interviewed tonight at 8:00pm by Anderson Cooper on _USERNAME_ I have no doubt she will do very well. Enjoy!
iPhone	I will sign the first bill to repeal #Obamacare and give Americans many choices and much lower rates!
iPhone	Trump Virginia Office Announces Statewide TV Ad Strategy and Leadership Team: _URL_ _URL_
iPhone	Join me in Colorado Springs, Colorado tomorrow at 1:00pm! #MAGA Tickets: _URL_
Android	New polls are good because the media has deceived the public by putting women front and center with made-up stories and lies, and got caught
iPhone	'Journalists shower Hillary Clinton with campaign cash' _URL_ _URL_
iPhone	'State Department official accused of offering 'quid pro quo' in Clinton email scandal' _URL_
Android	Voter fraud! Crooked Hillary Clinton even got the questions to a debate, and nobody says a word. Can you imagine if I got the questions?
iPhone	Unbelievable. _URL_
iPhone	WikiLeaks proves even the Clinton campaign knew Crooked mishandled classified info, but no one gets charged? RIGGED! _URL_
Android	We have all got to come together and win this election. We can't have four more years of Obama (or worse!).
Android	Of course there is large scale voter fraud happening on and before election day. Why do Republican leaders deny what is going on? So naive!
Android	'_USERNAME_ Peter Thiel chooses now to give $1.25mil in support of Trump _URL_
Android	'_USERNAME_ Trump accuser praised him in an email as recently as April! This is all yet another hoax. _URL_ Terrible
Android	'_USERNAME_ Watch Joe Biden's Long History Of Grabbing, Kissing and Groping Women Who Are Cringing: _URL_
Android	Can't believe these totally phoney stories, 100% made up by women (many already proven false) and pushed big time by press, have impact!
Android	ALL SAFE IN ORANGE COUNTY, NORTH CAROLINA. With you all the way, will never forget. Now we have to win. Proud of you all! _USERNAME_
Android	Animals representing Hillary Clinton and Dems in North Carolina just firebombed our office in Orange County because we are winning _USERNAME_
Android	Wow, interview released by Wikileakes shows 'quid pro quo' in Crooked Hillary e-mail probe.Such a dishonest person - & Paul Ryan does zilch!
Android	Finally, in the new ABC News/Washington Post Poll, Hillary Clinton is down 11 points with WOMEN VOTERS and the election is close at 47-43!
Android	Paul Ryan, a man who doesn't know how to win (including failed run four years ago), must start focusing on the budget, military, vets etc.
iPhone	Join me in Wisconsin tomorrow or Colorado on Tuesday! Green Bay- 6pm _URL_ Colorado Springs- 1pm… _URL_
iPhone	“The vast majority felt she should be prosecuted...' -- even senior FBI officials thought Crooked was guilty. _URL_
Android	The election is absolutely being rigged by the dishonest and distorted media pushing Crooked Hillary - but also at many polling places - SAD
iPhone	We've all wondered how Hillary avoided prosecution for her email scheme. Wikileaks may have found the answer. Obama! _URL_
iPhone	Hillary's staff thought her email scandal might just blow over. Who would trust these people with national security? _URL_
iPhone	A country that Crooked Hillary says has funded ISIS also gave Wild Bill $1 million for his birthday? SO CORRUPT! _URL_
iPhone	They let Crooked & the Gang off the hook for the crime, but it looks like the cover-up is just as bad. Unbelievable! _URL_
Android	Election is being rigged by the media, in a coordinated effort with the Clinton campaign, by putting stories that never happened into news!
Android	Polls close, but can you believe I lost large numbers of women voters based on made up events THAT NEVER HAPPENED. Media rigging election!
Android	Watched Saturday Night Live hit job on me.Time to retire the boring and unfunny show. Alec Baldwin portrayal stinks. Media rigging election!
Android	'_USERNAME_ _USERNAME_ Go Mr. Trump! Israel is behind you!'
iPhone	Thank you for sharing Amy. _URL_
Android	A great day in New Hampshire and Maine. Fantastic crowds and energy! #MAGA
iPhone	Thank you Bangor, Maine! Get out & #VoteTrumpPence16 on 11/8/16- and together we will MAKE AMERICA SAFE AND GREAT A… _URL_
Android	Nothing ever happened with any of these women. Totally made up nonsense to steal the election. Nobody has more respect for women than me!
iPhone	The MOVEMENT in Portsmouth, New Hampshire w/ 7K supporters. THANK YOU! This is the biggest election of our lifetime… _URL_
iPhone	Landing in New Hampshire soon to talk about the massive drug problem there, and all over the country.
iPhone	The truth is a beautiful weapon. _URL_
Android	Hillary Clinton should have been prosecuted and should be in jail. Instead she is running for president in what looks like a rigged election
iPhone	Will be in Bangor, Maine today at 3pm- join me! #MAGA Tickets: _URL_ _URL_
Android	This election is being rigged by the media pushing false and unsubstantiated charges, and outright lies, in order to elect Crooked Hillary!
Android	100% fabricated and made-up charges, pushed strongly by the media and the Clinton Campaign, may poison the minds of the American Voter. FIX!
iPhone	Thank you _USERNAME_ #MakeAmericaGreatAgain _URL_
iPhone	Thank you Charlotte, North Carolina! We are going to have an AMAZING victory on November 8th...because this is all… _URL_
iPhone	Thank you for your support Greensboro, North Carolina. Next stop - Charlotte! #MAGA _URL_ _URL_
iPhone	WHAT THEY ARE SAYING ABOUT THE CLINTON CAMPAIGN’S ANTI-CATHOLIC BIGOTRY: _URL_
iPhone	Thank you to our U.S. Navy for protecting our country, both in times of peace & war. Together, WE WILL MAKE AMERICA… _URL_
iPhone	Join me live in Cincinnati, Ohio! #TrumpRally #MAGA _URL_
iPhone	Dem Gov. of MN. just announced that the Affordable Care Act (Obamacare) is no longer affordable. I've been saying this for years- disaster!
iPhone	Great event in Columbus- taking off for Cincinnati now. Great new Ohio poll out- thank you! OHIO NBC/WSJ/MARIST POLL Trump 42% Clinton 41%
iPhone	Just left a great rally in Florida - now heading to Ohio for two more. Will be there soon.
iPhone	I am making a major speech in West Palm Beach, Florida at noon. Tune in!
iPhone	Thank you! #MAGA #AmericaFirst _URL_
iPhone	Join me in Ohio & Maine! Cincinnati, Ohio- tonight @ 7:30pm: _URL_ Bangor, Maine - Saturday @ 3pm… _URL_
Android	Why didn't the writer of the twelve year old article in People Magazine mention the 'incident' in her story. Because it did not happen!
iPhone	I will be in Cincinnati, Ohio tomorrow night at 7:30pm- join me! #OhioVotesEarly #VoteTrumpPence16 Tickets:… _URL_
iPhone	The people of Cuba have struggled too long. Will reverse Obama's Executive Orders and concessions towards Cuba until freedoms are restored.
iPhone	PAY TO PLAY POLITICS. #CrookedHillary _URL_
iPhone	Very little pick-up by the dishonest media of incredible information provided by WikiLeaks. So dishonest! Rigged system!
Android	Crooked Hillary Clinton likes to talk about the things she will do but she has been there for 30 years - why didn't she do them?
iPhone	Thank you Florida- a MOVEMENT that has never been seen before and will never be seen again. Lets get out &… _URL_
iPhone	Join me Thursday in Florida & Ohio! West Palm Beach, FL at noon: _URL_ Cincinnati, OH this 7:30pm: _URL_
iPhone	Thank you Texas! If you haven't registered to VOTE- today is your last day. Go to: _URL_ & get ou… _URL_
iPhone	VOTER REGISTRATION DEADLINES TODAY. You can register now at: _URL_ and get out to… _URL_
iPhone	DON'T LET HER FOOL US AGAIN. _URL_
iPhone	Crooked's State Dept gave special attention to 'Friends of Bill' after the Haiti Earthquake. Unbelievable! _URL_
iPhone	I hope people are looking at the disgraceful behavior of Hillary Clinton as exposed by WikiLeaks. She is unfit to run.
Android	In Texas now, leaving soon for BIG rally in Florida!
Android	The very foul mouthed Sen. John McCain begged for my support during his primary (I gave, he won), then dropped me over locker room remarks!
iPhone	Wow. Unbelievable. _URL_
iPhone	Disloyal R's are far more difficult than Crooked Hillary. They come at you from all sides. They don’t know how to win - I will teach them!
iPhone	It is so nice that the shackles have been taken off me and I can now fight for America the way I want to.
Android	Our very weak and ineffective leader, Paul Ryan, had a bad conference call where his members went wild at his disloyalty.
iPhone	Despite winning the second debate in a landslide (every poll), it is hard to do well when Paul Ryan and others give zero support!
iPhone	Thank you Pennsylvania. This is a MOVEMENT like we have never seen before! #VoteTrumpPence16 on 11/8/16- together,… _URL_
iPhone	Is this really America? Terrible! _URL_
iPhone	Debate polls look great - thank you! #MAGA #AmericaFirst _URL_
iPhone	CNN is the worst - fortunately they have bad ratings because everyone knows they are biased. _URL_
Android	Paul Ryan should spend more time on balancing the budget, jobs and illegal immigration and not waste his time on fighting Republican nominee
Android	Thank you for all of the great comments on the debate last night. Very exciting!
iPhone	Thank you St. Louis, Missouri! #MakeAmericaGreatAgain _URL_ _URL_
iPhone	MY PRO-GROWTH Econ Plan: ✅Eliminate excessive regulations! ✅Lean government! ✅Lower taxes! #Debates … _URL_
iPhone	We're going to cut taxes BIG LEAGUE for the middle class. She's raising your taxes and I'm lowering your taxes! _URL_
iPhone	._USERNAME_ - ITS CALLED EXTREME VETTING! #Debates2016 _URL_
iPhone	ATTN: _USERNAME_ - Why did five of your staffers need FBI IMMUNITY?! #BigLeagueTruth #Debates
iPhone	If I win-I am going to instruct my AG to get a special prosecutor to look into your situation bc there's never been anything like your lies.
iPhone	Donald J. Trump's History Of Empowering Women #BigLeagueTruth _URL_
iPhone	My team of deplorables will be taking over my Twitter account for tonight's #debate #MakeAmericaGreatAgain
iPhone	The Palestinian terror attack today reminds the world of the grievous perils facing Israeli citizens....continued: _URL_
iPhone	Exclusive Video–Broaddrick, Willey, Jones to Bill's Defenders: ‘These Are Crimes,’ ‘Terrified’ of ‘Enabler’ Hillary _URL_
Android	So many self-righteous hypocrites. Watch their poll numbers - and elections - go down!
Android	'_USERNAME_ _USERNAME_ This Black Democrat is on the 'TRUMP TRAIN'!!'
Android	'_USERNAME_ _USERNAME_ GOP traitors! Not supporting U is voting for her, destroying America.
Android	'_USERNAME_ _USERNAME_ politicians don't count. It's the people. We are behind trump all the way to White House.'
Android	'_USERNAME_ _USERNAME_ 'Republican leadership' should have only one job: Help elect the nominee we voted for, Donald J. Trump.'
Android	'_USERNAME_ _USERNAME_ I am a woman who continues to support & stand with #Trump! #dtmag _URL_ Thank you.
iPhone	EXCLUSIVE — Video Interview: Bill Clinton Accuser Juanita Broaddrick Relives Brutal Rapes: _URL_
Android	Tremendous support (except for some Republican 'leadership'). Thank you.
Android	Thank you to my great supporters in Wisconsin. I heard that the crowd and enthusiasm was unreal!
