Android	Michael Morell, the lightweight former Acting Director of C.I.A., and a man who has made serious bad calls, is a total Clinton flunky!
Android	The media is going crazy. They totally distort so many things on purpose. Crimea, nuclear, 'the baby' and so much more. Very dishonest!
Android	I see where Mayor Stephanie Rawlings-Blake of Baltimore is pushing Crooked hard. Look at the job she has done in Baltimore. She is a joke!
iPhone	Thank you Windham, New Hampshire! #TrumpPence16 #MAGA _URL_
iPhone	._USERNAME_ - 'Donald Trump Is the middle-class growth candidate' _URL_
Android	I am not just running against Crooked Hillary Clinton, I am running against the very dishonest and totally biased media - but I will win!
iPhone	#CrookedHillary is not fit to be our next president! #TrumpPence16 _URL_
Android	Heading to New Hampshire - will be talking about Hillary saying her brain SHORT CIRCUITED, and other things!
Android	Anybody whose mind 'SHORT CIRCUITS' is not fit to be our president! Look up the word 'BRAINWASHED.'
Android	Crooked Hillary said loudly, and for the world to see, that she 'SHORT CIRCUITED' when answering a question on her e-mails. Very dangerous!
iPhone	Good luck #TeamUSA #OpeningCeremony #Rio2016 _URL_
iPhone	'Trump is right about violent crime: It’s on the rise in major cities' _URL_
iPhone	Thank you Green Bay, Wisconsin! Governor _USERNAME_ and I will be back soon. #TrumpPence16 #MAGA _URL_
iPhone	Thank you Des Moines, Iowa! Governor _USERNAME_ and I appreciate your support! #MAGA #TrumpTrain _URL_
iPhone	#MakeAmericaSafeAgain _URL_
iPhone	Hillary Clinton has bad judgment and is unfit to serve as President. _URL_
Android	The plane I saw on television was the hostage plane in Geneva, Switzerland, not the plane carrying $400 million in cash going to Iran!
iPhone	President Obama refuses to answer question about Iran terror funding. I won't dodge questions as your President. _URL_
iPhone	Obama's disastrous judgment gave us ISIS, rise of Iran, and the worst economic numbers since the Great Depression!
iPhone	President Obama should ask the DNC about how they rigged the election against Bernie.
iPhone	See you tomorrow w/ Gov. _USERNAME_ Iowa & Wisconsin! 3pm- _URL_ 7pm- _URL_ _URL_
iPhone	Thank you Portland, Maine! #MakeAmericaGreatAgain _URL_ _URL_
iPhone	Happy 226th Birthday to the United States Coast Guard. Thank you _USERNAME_ #CoastGuardDay _URL_
iPhone	Great meeting all of you. This group knocked on 50K doors & counting here in Maine, thank you! _USERNAME_ _URL_
iPhone	Thank you Jacksonville, Florida! #MakeAmericaGreatAgain _URL_ _URL_
iPhone	Thank you for your support of my candidacy! #MAGA #ImWithYou _URL_
iPhone	Thank you to the amazing law enforcement officers today- in Daytona Beach, Florida! #LESM #MAGA _URL_
iPhone	THANK YOU Daytona Beach, Florida! #MakeAmericaGreatAgain _URL_
Android	Our incompetent Secretary of State, Hillary Clinton, was the one who started talks to give 400 million dollars, in cash, to Iran. Scandal!
Android	There is great unity in my campaign, perhaps greater than ever before. I want to thank everyone for your tremendous support. Beat Crooked H!
Android	Great day in Virginia. Crowd was fantastic!
iPhone	My daughter _USERNAME_ will be on _USERNAME_ tonight at 7pm. Enjoy! _URL_
iPhone	Report raises questions about ‘Clinton Cash’ from Russians during ‘reset' _URL_
Android	President Obama will go down as perhaps the worst president in the history of the United States!
iPhone	#ICYMI: John Podesta’s Brother Pocketed $180,000 from Putin’s Uranium Company: _URL_ _URL_
iPhone	#CrookedHillary _URL_
iPhone	Join me in Florida tomorrow! #MakeAmericaGreatAgain Daytona | 3pm- _URL_ Jacksonville | 7pm- _URL_
iPhone	STATEMENT IN RESPONSE TO PRESIDENT OBAMA'S FAILED LEADERSHIP: _URL_
iPhone	The Washington Post calls out #CrookedHillary for what she REALLY is. A PATHOLOGICAL LIAR! Watch that nose grow! _URL_
iPhone	Great afternoon in Ohio & a great evening in Pennsylvania - departing now. See you tomorrow Virginia! _URL_
iPhone	Just leaving Mechanicsburg, PA. Incredible crowd-- so enthusiastic! Will be back soon. #MAGA _URL_
iPhone	Vast numbers of manufacturing jobs in Pennsylvania have moved to Mexico and other countries. That will end when I win!
iPhone	Thanks to _USERNAME_ for your kind words, very much appreciated.
iPhone	Join me in Florida on Wednesday! Daytona & Jacksonville: Daytona | 3pm- _URL_ Jacksonville | 7pm- _URL_
iPhone	During the GOP convention, CNN cut away from the victims of illegal immigrant violence. They don’t want them heard. _URL_
iPhone	When will CNN do a segment on Hillary’s plan to increase Syrian refugees 550% and how much it will cost?
iPhone	Hillary Clinton raked in money from regimes that horribly oppress women and gays & refuses to speak out against Radical Islam.
iPhone	Hillary, whose decisions have led to the deaths of many, accepted $ from a business linked to ISIS. Silence at CNN. _URL_
iPhone	Crooked Hillary Clinton is 100% owned by her donors. #ImWithYou #MAGA _URL_
iPhone	Thank you Columbus, Ohio! I will be back soon. #ImWithYou #MAGA _URL_
iPhone	Thank you Oklahoma & Virginia! #MakeAmericaGreatAgain #ImWithYou _URL_
iPhone	People believe CNN these days almost as little as they believe Hillary....that's really saying something!
iPhone	Will CNN send its cameras to the border to show the massive unreported crisis now unfolding -- or are they worried it will hurt Hillary?
iPhone	When will we see stories from CNN on Clinton Foundation corruption and Hillary's pay-for-play at State Department?
iPhone	CNN anchors are completely out of touch with everyday people worried about rising crime, failing schools and vanishing jobs.
iPhone	CNN will soon be the least trusted name in news if they continue to be the press shop for Hillary Clinton.
iPhone	Join Governor Mike Pence in Reno, Nevada- tonight at 7pm! Tickets available at: _URL_
iPhone	#CrookedHillary _URL_
Android	So with all of the Obama tough talk on Russia and the Ukraine, they have already taken Crimea and continue to push. That's what I said!
Android	When I said in an interview that Putin is 'not going into Ukraine, you can mark it down,' I am saying if I am President. Already in Crimea!
Android	This story is not about Mr. Khan, who is all over the place doing interviews, but rather RADICAL ISLAMIC TERRORISM and the U.S. Get smart!
Android	Mr. Khan, who does not know me, viciously attacked me from the stage of the DNC and is now all over T.V. doing the same - Nice!
Android	Wow, it is unbelievable how distorted, one-sided and biased the media is against us. The failing _USERNAME_ is a joke. _USERNAME_ is laughable!
Android	'_USERNAME_ Without absolutely OWNING the liberal media, HillaryClinton wouldn't stand a chance. #VoterFraud and #MSM her only hope.'
Android	The dishonest media is fawning over the Democratic Convention. I wonder why, then, my speech had millions of more viewers than Crooked H?
Android	I was viciously attacked by Mr. Khan at the Democratic Convention. Am I not allowed to respond? Hillary voted for the Iraq war, not me!
Android	Nielson Media Research final numbers on ACCEPTANCE SPEECH: TRUMP 32.2 MILLION. CLINTON 27.8 MILLION. Thank you!
Android	Thank you to all of the television viewers that made my speech at the Republican National Convention #1 over Crooked Hillary and DEMS.
Android	Can you imagine if I had the small crowds that Hillary is drawing today in Pennsylvania. It would be a major media event! _USERNAME_ _USERNAME_
iPhone	NATO commander agrees members should pay up via _USERNAME_ _URL_
Android	Wow, NATO's top commander just announced that he agrees with me that alliance members must PAY THEIR BILLS. This is a general I will like!
Android	The 'Rust Belt' was created by politicians like the Clintons who allowed our jobs to be stolen from us by other countries like Mexico. END!
Android	Crooked's stop in Johnstown, Pennsylvania, where jobs have been absolutely decimated by dumb politicians, drew less than 200 - with Bill, VP
iPhone	#CrookedHillary = Obama's third term, which would be terrible news for our economic growth - seen below. _URL_
Android	Word is that Crooked Hillary has very small and unenthusiastic crowds in Pennsylvania. Perhaps it is because her husband signed NAFTA?
Android	I turned down a meeting with Charles and David Koch. Much better for them to meet with the puppets of politics, they will do much better!
Android	Why doesn't the media want to report that on the two 'Big Thursdays' when Crooked Hillary and I made our speeches - Republican's won ratings
iPhone	#CrookedHillary _URL_
iPhone	Crooked Hillary Clinton is soft on crime, supports open borders, and wants massive tax hikes. A formula for disaster!
iPhone	Violent crime is rising across the United States, yet the DNC convention ignored it. Crime reduction will be one of my top priorities.
iPhone	While I am in OH & PA - you can also join _USERNAME_ in Nevada on Mon! Carson City: _URL_ Reno: _URL_
iPhone	Join me Monday in Columbus, Ohio & Harrisburg, Pennsylvania! #MAGA 3pm in OH: _URL_ 7pm in PA: _URL_
iPhone	American homeownership rate in Q2 2016 was 62.9% - lowest rate in 51yrs. WE will bring back the 'American Dream!' _URL_
iPhone	We are suffering through the worst long-term unemployment in the last 70 years. I want change - Crooked Hillary Clinton does not.
iPhone	Hillary can never win over Bernie supporters. Her foreign wars, NAFTA/TPP support & Wall Street ties are driving away millions of votes.
iPhone	Colorado was amazing yesterday! So much support. Our tax, trade and energy reforms will bring great jobs to Colorado and the whole country.
Android	'_USERNAME_ _USERNAME_ ONLY TRUMP CAN UNITE AMERICA AND FIX OBAMA'S MISTAKES!!! #Trump2016 _URL_
iPhone	Thank you Denver, Colorado! #MakeAmericaGreatAgain! _URL_
iPhone	As usual, Hillary & the Dems are trying to rig the debates so 2 are up against major NFL games. Same as last time w/ Bernie. Unacceptable!
iPhone	#CrookedHillary Job Application _URL_
iPhone	Hillary Clinton should not be given national security briefings in that she is a lose cannon with extraordinarily bad judgement & insticts.
iPhone	Thank you to the amazing law enforcement officers in Colorado! #MakeAmericaGreatAgain #LESM _URL_
iPhone	Thank you Colorado Springs. Get out & VOTE #TrumpPence16 in November! _URL_
iPhone	'Only a Reagan or a Trump-like figure in the White House will achieve this goal.' _URL_
iPhone	What Bernie Sanders really thinks of Crooked Hillary Clinton. _URL_
Android	I am watching Crooked Hillary speak. Same old stuff, our country needs change!
Android	Wow, my campaign is hearing from more and more Bernie supporters that they will NEVER support Crooked Hillary. She sold them out, V.P. pick!
iPhone	In Hillary Clinton's America - things get worse. #TrumpPence16 _URL_
Android	The dishonest media didn't mention that Bernie Sanders was very angry looking during Crooked's speech. He wishes he didn't make that deal!
iPhone	Thank you! Facebook: _URL_ Instagram: _URL_ _URL_
Android	Crooked Hillary said that I 'couldn't handle the rough and tumble of a political campaign.' Really,I just beat 16 people and am beating her!
Android	If Michael Bloomberg ran again for Mayor of New York, he wouldn't get 10% of the vote - they would run him out of town! #NeverHillary
Android	'Little' Michael Bloomberg, who never had the guts to run for president, knows nothing about me. His last term as Mayor was a disaster!
Android	General John Allen, who I never met but spoke against me last night, failed badly in his fight against ISIS. His record = BAD #NeverHillary
Android	Crooked Hillary Clinton mentioned me 22 times in her very long and very boring speech. Many of her statements were lies and fabrications!
iPhone	Join _USERNAME_ at the University of Northwestern Ohio- tonight at 7pm. Tickets: _URL_
Android	'_USERNAME_ 'I believe in science' Dem code for 'we're shutting down coal mines, steel plants and any other remaining manufacturing''
iPhone	CAMPAIGN STATEMENT: _URL_
Android	Crooked Hillary Clinton made up facts about me, and 'forgot' to mention the many problems of our country, in her very average scream!
Android	The media coverage this morning of the very average Clinton speech and Convention is a joke. _USERNAME_ and the little watched _USERNAME_ = SAD!
iPhone	No one has worse judgement than Hillary Clinton - corruption and devastation follows her wherever she goes.
iPhone	Hillary's wars in the Middle East have unleashed destruction, terrorism and ISIS across the world.
iPhone	Hillary's vision is a borderless world where working people have no power, no jobs, no safety.
iPhone	Hillary will never reform Wall Street. She is owned by Wall Street!
iPhone	Our way of life is under threat by Radical Islam and Hillary Clinton cannot even bring herself to say the words.
iPhone	Hillary's refusal to mention Radical Islam, as she pushes a 550% increase in refugees, is more proof that she is unfit to lead the country.
iPhone	Departing now - thank you Cedar Rapids, Iowa. This is a MOVEMENT! _URL_
iPhone	#CrookedHillary _URL_
iPhone	'Dems warn not to underestimate Trump's potential win' _URL_
iPhone	Great to be back in Iowa! #TBT with _USERNAME_ joining me in Davenport- this past winter. #MAGA _URL_
iPhone	Median household income is down for the middle class since Obama took office. It will only go further down under Clinton.
iPhone	A vote for Clinton-Kaine is a vote for TPP, NAFTA, high taxes, radical regulation, and massive influx of refugees.
Android	'_USERNAME_ Poll: Donald Trump Sees 17-Point Positive Swing in Two Weeks - Breitbart _URL_ _USERNAME_ Great!
Android	'_USERNAME_ _USERNAME_ _USERNAME_ stay the course mr trump your message is resonating with the PEOPLE'
Android	'_USERNAME_ Barack is offended that _USERNAME_ will demand that #NATO allies pay their fair share. #DemsInPhilly'
iPhone	Our country does not feel 'great already' to the millions of wonderful people living in poverty, violence and despair.
iPhone	Shooting deaths of police officers up 78% this year. We must restore law and order and protect our great law enforcement officers!
iPhone	Join me live in Toledo, Ohio! #MakeAmericaGreatAgain _URL_
iPhone	#CrookedHillary _URL_
iPhone	Thank you Pennsylvania! #MakeAmericaGreatAgain _URL_ _URL_
iPhone	Thank you to our amazing law enforcement officers! #MAGA _URL_
iPhone	'Trump right: Illegal families crossing border set to double, 51,152 so far' _URL_
iPhone	Great new poll - thank you! #MakeAmericaGreatAgain _URL_
iPhone	If Russia or any other country or person has Hillary Clinton's 33,000 illegally deleted emails, perhaps they should share them with the FBI!
iPhone	Join our next Vice President, _USERNAME_ in Wisconsin tonight & Michigan Thursday! MI: _URL_ WI: _URL_
Android	Not one American flag on the massive stage at the Democratic National Convention until people started complaining-then a small one. Pathetic
Android	Crooked Hillary Clinton wants to flood our country with Syrian immigrants that we know little or nothing about. The danger is massive. NO!
Android	Hopefully the violent and vicious killing by ISIS of a beloved French priest is causing people to start thinking rationally. Get tough!
Android	The Democratic Convention has paid ZERO respect to the great police and law enforcement professionals of our country. No recognition - SAD!
Android	Funny how the failing _USERNAME_ is pushing Dems narrative that Russia is working for me because Putin said 'Trump is a genius.' America 1st!
Android	As I have been saying, Crooked Hillary will approve the job killing TPP after the election, despite her statements to the contrary: top adv.
iPhone	Just like I have warned from the beginning, Crooked Hillary Clinton will betray you on the TPP. _URL_
Android	Many of Bernie's supporters have left the arena. Did Bernie go home and go to sleep?
Android	I hate to say it, but the Republican Convention was far more interesting (with a much more beautiful set) than the Democratic Convention!
Android	No matter what Bill Clinton says and no matter how well he says it, the phony media will exclaim it to be incredible. Highly overrated!
Android	You have no idea what my strategy on ISIS is, and neither does ISIS (a good thing). Please get your facts straight - thanks. _USERNAME_
Android	For the record, I have ZERO investments in Russia.
Android	In order to try and deflect the horror and stupidity of the Wikileakes disaster, the Dems said maybe it is Russia dealing with Trump. Crazy!
iPhone	Dems don't want to talk ISIS b/c Hillary's foreign interventions unleashed ISIS & her refugee plans make it easier for them to come here.
iPhone	Bernie's exhausted, he just wants to shut down and go home to bed!
iPhone	Thank you New Hampshire! #MakeAmericaGreatAgain _URL_
iPhone	Join us in Toledo, Ohio- tomorrow night at 8pm! #TrumpPence16 #MAGA Tickets: _URL_ _URL_
iPhone	Join us tomorrow in Scranton, Pennsylvania at 3pm! #TrumpPence16 #MAGA Tickets: _URL_ _URL_
Android	Pocahontas bombed last night! Sad to watch.
Android	Why aren't the Democrats speaking about ISIS, bad trade deals, broken borders, police and law and order. The Republican Convention was great
Android	Funny, if you listen to _USERNAME_ the Democrats did not have a good day. If you listen to the other two, they are fawning. What a difference
Android	Bernie Sanders totally sold out to Crooked Hillary Clinton. All of that work, energy and money, and nothing to show for it! Waste of time.
Android	Elizabeth Warren, often referred to as Pocahontas, just misrepresented me and spoke glowingly about Crooked Hillary, who she always hated!
iPhone	Sad to watch Bernie Sanders abandon his revolution. We welcome all voters who want to fix our rigged system and bring back our jobs.
iPhone	If Cory Booker is the future of the Democratic Party, they have no future! I know more about Cory than he knows about himself.
Android	I was at _USERNAME_ and met Juan Williams in passing. He asked if he could have pictures taken with me. I said fine. He then trashes on air!
Android	Hard to believe that Bernie Sanders has done such a complete fold. He got NOTHING for all of the time, energy and money. The V.P. a joke!
iPhone	While Bernie has totally given up on his fight for the people, we welcome all voters who want a better future for our workers.
iPhone	Clinton betrayed Bernie voters. Kaine supports TPP, is in pocket of Wall Street, and backed Iraq War.
iPhone	Thank you Roanoke, Virginia- be back soon! #TrumpPence16 _URL_ _URL_
iPhone	MAKE AMERICA SAFE AND GREAT AGAIN! #TrumpPence16 _URL_ _URL_
iPhone	#MakeAmericaGreatAgain _URL_ _URL_
Android	Great POLL numbers are coming out all over. People don't want another four years of Obama, and Crooked Hillary would be even worse. #MAGA
Android	The State of Florida is so embarrassed by the antics of Crooked Hillary Clinton and Debbie Wasserman Schultz that they will vote for CHANGE!
Android	Wow, the Republican Convention went so smoothly compared to the Dems total mess. But fear not, the dishonest media will find a good spinnnn!
Android	Here we go again with another Clinton scandal, and e-mails yet (can you believe). Crooked Hillary knew the fix was in, B never had a chance!
Android	Crooked Hillary Clinton knew everything that her 'servant' was doing at the DNC - they just got caught, that's all! They laughed at Bernie.
Android	If Bernie Sanders, after seeing the just released e-mails, continues to look exhausted and done, then his legacy will never be the same.
Android	Hillary was involved in the e-mail scandal because she is the only one with judgement so bad that such a thing could have happened!
Android	How much BAD JUDGEMENT was on display by the people in DNC in writing those really dumb e-mails, using even religion, against Bernie!
Android	The new joke in town is that Russia leaked the disastrous DNC e-mails, which should never have been written (stupid), because Putin likes me
Android	Watched Crooked Hillary Clinton and Tim Kaine on 60 Minutes. No way they are going to fix America's problems. ISIS & all others laughing!
Android	The ratings for the Republican National Convention were very good, but for the final night, my speech, great. Thank you!
Android	The Democrats are in a total meltdown but the biased media will say how great they are doing! E-mails say the rigged system is alive & well!
Android	Even though Bernie Sanders has lost his energy and his strength, I don't believe that his supporters will let Crooked Hillary off the hook!
Android	Crooked Hillary Clinton was not at all loyal to the person in her rigged system that pushed her over the top, DWS. Too bad Bernie flamed out
Android	If the Republican Convention had blown up with e-mails, resignation of boss and the beat down of a big player. (Bernie), media would go wild
Android	The _USERNAME_ panels are so one sided, almost all against Trump. _USERNAME_ is so much better and the ratings are much higher. Don't watch CNN!
Android	I always said that Debbie Wasserman Schultz was overrated. The Dems Convention is cracking up and Bernie is exhausted, no energy left!
iPhone	Today proves what I have always known, that _USERNAME_ Priebus is the tough one and the smart one, not Debbie Wasserman Shultz (_USERNAME_
Android	Sorry folks, but Bernie Sanders is exhausted, just can't go on any longer. He is trying to dismiss the new e-mails and DNC disrespect. SAD!
Android	There is no longer a Bernie Sanders 'political revolution.' He is turning out to be a weak and somewhat pathetic figure,wants it all to end!
Android	An analysis showed that Bernie Sanders would have won the Democratic nomination if it were not for the Super Delegates.
Android	Looks like the Bernie people will fight. If not, their BLOOD, SWEAT AND TEARS was a total waste of time. Kaine stands for opposite!
Android	Wow, President Obama's brother, Malik, just announced that he is voting for me. Was probably treated badly by president-like everybody else!
Android	Bernie Sanders started off strong, but with the selection of Kaine for V.P., is ending really weak. So much for a movement! TOTAL DISRESPECT
Android	The Crooked Hillary V.P. choice is VERY disrespectful to Bernie Sanders and all of his supporters. Just another case of BAD JUDGEMENT by H!
Android	'_USERNAME_ _USERNAME_ Dinesh D'Sousa Hillary's America. see it'
Android	'_USERNAME_ _USERNAME_ Kaine supported the stupidest deal in the history of deals _URL_ #HillaryKaine2016'
Android	Thank you to everyone for the wonderful reviews of my speech on Thursday night. From the heart!
iPhone	The Wikileaks e-mail release today was so bad to Sanders that it will make it impossible for him to support her, unless he is a fraud!
Android	Just saw Crooked Hillary and Tim Kaine together. ISIS and our other enemies are drooling. They don't look presidential to me!
Android	I will bring jobs back and get wages up. People haven't had a real wage increase in almost twenty years. Clinton killed jobs!
Android	Tim Kaine has been praising the Trans Pacific Partnership and has been pushing hard to get it approved. Job killer!
Android	Funny that the Democrats would have their convention in Pennsylvania where her husband and her killed so many jobs. I will bring jobs back!
Android	Crooked Hillary Clinton has destroyed jobs and manufacturing in Pennsylvania. Against steelworkers and miners. Husband signed NAFTA.
Android	Leaked e-mails of DNC show plans to destroy Bernie Sanders. Mock his heritage and much more. On-line from Wikileakes, really vicious. RIGGED
Android	Pocahontas wanted V.P. slot so badly but wasn't chosen because she has done nothing in the Senate. Also, Crooked Hillary hates her!
Android	Tim Kaine is, and always has been, owned by the banks. Bernie supporters are outraged, was their last choice. Bernie fought for nothing!
Android	The Bernie Sanders supporters are furious with the choice of Tim Kaine, who represents the opposite of what Bernie stands for. Philly fight?
Android	'_USERNAME_ _USERNAME_ General Michael Flynn will make a great Secretary of Defense when you become POTUS! #MakeAmericaSafeAgain'
Android	Is it the same Kaine that took hundreds of thousands of dollars in gifts while Governor of Virginia and didn't get indicted while Bob M did?
Android	Another attack, this time in Germany. Many killed. God bless the people of Munich.
Android	One of the best produced, including the incredible stage & set, in the history of conventions. Great unity! Big T.V. ratings! _USERNAME_
Android	Thank you Cleveland. We love you and will be back many times!
Android	What a great four days in Cleveland. So proud of the great job done by the RNC and all. The police and Secret Service were fantastic!
iPhone	MAKE AMERICA SAFE AND GREAT AGAIN! #RNCinCLE _URL_
iPhone	FORMAL ACCEPTANCE OF THE NOMINATION! #TrumpPence16 _URL_
iPhone	This is a MOVEMENT! #RNCinCLE _URL_
iPhone	Thank you _USERNAME_ Proud of you! #RNCinCLE #TrumpPence2016 _URL_
Android	Other than a small group of people who have suffered massive and embarrassing losses, the party is VERY united. Great love in the arena!
Android	Ted Cruz talks about the Constitution but doesn't say that if the Dems win the Presidency, the new JUSTICES appointed will destroy us all!
Android	I am soooo proud of my children, Don, Eric and Tiffany - their speeches, under enormous pressure, were incredible. Ivanka intros me tonight!
iPhone	MAKE AMERICA GREAT AGAIN! _URL_
Android	Arena was packed, totally electric!
iPhone	Our next Vice President of the United States of America, Gov. _USERNAME_ #GOPinCLE #GOPConvention #AmericaFirst _URL_
Android	Wow, Ted Cruz got booed off the stage, didn't honor the pledge! I saw his speech two hours early but let him speak anyway. No big deal!
iPhone	Great job _USERNAME_ Proud of you! #AmericaFirst #RNCinCLE _URL_ _URL_
Android	Thank you to Governor _USERNAME_ for such warm support. Great speech!
iPhone	#AmericaFirst #RNCinCLE _URL_
iPhone	Watching the #GOPConvention #AmericaFirst #RNCinCLE
