Android	My statement as to what's happening in Sweden was in reference to a story that was broadcast on _USERNAME_ concerning immigrants & Sweden.
Android	Will be having many meetings this weekend at The Southern White House. Big 5:00 P.M. speech in Melbourne, Florida. A lot to talk about!
Android	Don't believe the main stream (fake news) media.The White House is running VERY WELL. I inherited a MESS and am in the process of fixing it.
Android	Looking forward to the Florida rally tomorrow. Big crowd expected!
Android	'One of the most effective press conferences I've ever seen!' says Rush Limbaugh. Many agree.Yet FAKE MEDIA calls it differently! Dishonest
Android	The FAKE NEWS media (failing _USERNAME_ _USERNAME_ _USERNAME_ _USERNAME_ _USERNAME_ is not my enemy, it is the enemy of the American People!
iPhone	Join me at 11:00am: Watch here: _URL_ _URL_
iPhone	General Keith Kellogg, who I have known for a long time, is very much in play for NSA - as are three others.
Android	Thank you for all of the nice statements on the Press Conference yesterday. Rush Limbaugh said one of greatest ever. Fake media not happy!
Android	Going to Charleston, South Carolina, in order to spend time with Boeing and talk jobs! Look forward to it.
Android	Despite the long delays by the Democrats in finally approving Dr. Tom Price, the repeal and replacement of ObamaCare is moving fast!
iPhone	'Trump signs bill undoing Obama coal mining rule' _URL_
Android	The Democrats had to come up with a story as to why they lost the election, and so badly (306), so they made up a story - RUSSIA. Fake news!
Android	FAKE NEWS media, which makes up stories and 'sources,' is far more effective than the discredited Democrats - but they are fading fast!
Android	Leaking, and even illegal classified leaking, has been a big problem in Washington for years. Failing _USERNAME_ (and others) must apologize!
Android	Stock market hits new high with longest winning streak in decades. Great level of confidence and optimism - even before tax plan rollout!
iPhone	Venezuela should allow Leopoldo Lopez, a political prisoner & husband of _USERNAME_ (just met w/ _USERNAME_ o… _URL_
iPhone	Aetna CEO: Obamacare in 'Death Spiral' #RepealAndReplace _URL_
iPhone	Join me in Florida this Saturday at 5pm for a rally at the Orlando-Melbourne International Airport! Tickets:… _URL_
iPhone	Welcome to the United States, _USERNAME_ Benjamin & Sara! #ICYMI🇺🇸🇮🇱Joint Press Conference: _URL_ _URL_
iPhone	Great listening session with CEO's of the Retail Industry Leaders Association this morning! _URL_
Android	The real scandal here is that classified information is illegally given out by 'intelligence' like candy. Very un-American!
Android	Crimea was TAKEN by Russia during the Obama Administration. Was Obama too soft on Russia?
Android	Thank you to Eli Lake of The Bloomberg View - 'The NSA & FBI...should not interfere in our politics...and is' Very serious situation for USA
Android	Information is being illegally given to the failing _USERNAME_ & _USERNAME_ by the intelligence community (NSA and FBI?).Just like Russia
Android	This Russian connection non-sense is merely an attempt to cover-up the many mistakes made in Hillary Clinton's losing campaign.
Android	The fake news media is going crazy with their conspiracy theories and blind hatred. _USERNAME_ & _USERNAME_ are unwatchable. _USERNAME_ is great!
iPhone	Obamacare continues to fail. Humana to pull out in 2018. Will repeal, replace & save healthcare for ALL Americans. _URL_
iPhone	Great parent-teacher listening session this morning with _USERNAME_ Pence & _USERNAME_ Secretary _USERNAME_ Watch:… _URL_
Android	The real story here is why are there so many illegal leaks coming out of Washington? Will these leaks be happening as I deal on N.Korea etc?
iPhone	Congratulations to our new #VASecretary Dr. David Shulkin. Time to take care of Veterans who have fought to protect… _URL_
iPhone	Congratulations Treasury Secretary Steven Mnuchin! #ICYMI- watch here: _URL_ _URL_
iPhone	Wonderful meeting with Canadian PM _USERNAME_ and a group of leading CEO's & business women from Canada🇨🇦and th… _URL_
iPhone	Welcome to the _USERNAME_ Prime Minister _USERNAME_ _URL_
iPhone	Today I will meet with Canadian PM Trudeau and a group of leading business women to discuss women in the workforce. _URL_
Android	Just leaving Florida. Big crowds of enthusiastic supporters lining the road that the FAKE NEWS media refuses to mention. Very dishonest!
iPhone	Congratulations Stephen Miller- on representing me this morning on the various Sunday morning shows. Great job!
Android	I know Mark Cuban well. He backed me big-time but I wasn't interested in taking all of his calls.He's not smart enough to run for president!
Android	After two days of very productive talks, Prime Minister Abe is heading back to Japan. L
Android	While on FAKE NEWS _USERNAME_ Bernie Sanders was cut off for using the term fake news to describe the network. They said technical difficulties!
Android	72% of refugees admitted into U.S. (2/3 -2/11) during COURT BREAKDOWN are from 7 countries: SYRIA, IRAQ, SOMALIA, IRAN, SUDAN, LIBYA & YEMEN
Android	The crackdown on illegal criminals is merely the keeping of my campaign promise. Gang members, drug dealers & others are being removed!
Android	A working dinner tonight with Prime Minister Abe of Japan, and his representatives, at the Winter White House (Mar-a-Lago). Very good talks!
iPhone	Played golf today with Prime Minister Abe of Japan and _USERNAME_ Ernie Els, and had a great time. Japan is very well represented!
Android	I am so proud of my daughter Ivanka. To be abused and treated so badly by the media, and to still hold her head so high, is truly wonderful!
iPhone	Having a great time hosting Prime Minister Shinzo Abe in the United States! _URL_ _URL_
Android	Melania and I are hosting Japanese Prime Minister Shinzo Abe and Mrs. Abe at Mar-a-Lago in Palm Beach, Fla. They are a wonderful couple!
Android	...design or negotiations yet. When I do, just like with the F-35 FighterJet or the Air Force One Program, price will come WAY DOWN!
Android	I am reading that the great border WALL will cost more than the government originally thought, but I have not gotten involved in the.....
Android	Our legal system is broken! '77% of refugees allowed into U.S. since travel reprieve hail from seven suspect countries.' (WT) SO DANGEROUS!
iPhone	Heading to Joint Base Andrews on #MarineOne with Prime Minister Shinzō earlier today. _URL_
Android	The failing _USERNAME_ does major FAKE NEWS China story saying 'Mr.Xi has not spoken to Mr. Trump since Nov.14.' We spoke at length yesterday!
Android	LAWFARE: 'Remarkably, in the entire opinion, the panel did not bother even to cite this (the) statute.' A disgraceful decision!
Android	SEE YOU IN COURT, THE SECURITY OF OUR NATION IS AT STAKE!
iPhone	Join us live in the Oval Office for the swearing in of our new Attorney General, _USERNAME_ LIVE:… _URL_
Android	..Ryan died on a winning mission ( according to General Mattis), not a 'failure.' Time for the U.S. to get smart and start winning again!
Android	Sen. McCain should not be talking about the success or failure of a mission to the media. Only emboldens the enemy! He's been losing so....
Android	Chris Cuomo, in his interview with Sen. Blumenthal, never asked him about his long-term lie about his brave 'service' in Vietnam. FAKE NEWS!
Android	Sen.Richard Blumenthal, who never fought in Vietnam when he said for years he had (major lie),now misrepresents what Judge Gorsuch told him?
iPhone	Congratulations to our new Attorney General, _USERNAME_ _URL_
iPhone	'Trump administration seen as more truthful than news media' _URL_
iPhone	'Majority in Leading EU Nations Support Trump-Style Travel Ban' Poll of more than 10,000 people in 10 countries..._URL_
iPhone	'Immigration Ban Is One Of Trump's Most Popular Orders So Far' _URL_
iPhone	Thank you Brian Krzanich, CEO of _USERNAME_ A great investment ($7 BILLION) in American INNOVATION and JOBS!… _URL_
Android	Big increase in traffic into our country from certain areas, while our people are far more vulnerable, as we wait for what should be EASY D!
iPhone	'16 Fake News Stories Reporters Have Run Since Trump Won' _URL_
iPhone	My daughter Ivanka has been treated so unfairly by _USERNAME_ She is a great person -- always pushing me to do the right thing! Terrible!
iPhone	Thank you to our great Police Chiefs & Sheriffs for your leadership & service. You have a true friend in the… _URL_
Android	I will be speaking at 9:00 A.M. today to Police Chiefs and Sheriffs and will be discussing the horrible, dangerous and wrong decision.......
Android	If the U.S. does not win this case as it so obviously should, we can never have the security and safety to which we are entitled. Politics!
iPhone	An honor having the National Sheriffs' Assoc. join me at the _USERNAME_ Incredible men & women who protect & serv… _URL_
iPhone	I don't know Putin, have no deals in Russia, and the haters are going crazy - yet Obama can make a deal with Iran, #1 in terror, no problem!
Android	The threat from radical Islamic terrorism is very real, just look at what is happening in Europe and the Middle-East. Courts must act fast!
Android	The failing _USERNAME_ was forced to apologize to its subscribers for the poor reporting it did on my election win. Now they are worse!
iPhone	An extended interview from the Super Bowl with _USERNAME_ airs tonight at 8:00 P.M. Enjoy! _URL_
Android	The failing _USERNAME_ writes total fiction concerning me. They have gotten it wrong for two years, and now are making up stories & sources!
Android	I call my own shots, largely based on an accumulation of data, and everyone knows it. Some FAKE NEWS media, in order to marginalize, lies!
Android	Any negative polls are fake news, just like the CNN, ABC, NBC polls in the election. Sorry, people want border security and extreme vetting.
Android	What an amazing comeback and win by the Patriots. Tom Brady, Bob Kraft and Coach B are total winners. Wow!
Android	Enjoy the #SuperBowl and then we continue: MAKE AMERICA GREAT AGAIN!
Android	I have instructed Homeland Security to check people coming into our country VERY CAREFULLY. The courts are making the job very difficult!
Android	Just cannot believe a judge would put our country in such peril. If something happens blame him and court system. People pouring in. Bad!
Android	The judge opens up our country to potential terrorists and others that do not have our best interests at heart. Bad people are very happy!
Android	Interview with _USERNAME_ on Fox Network - 4:00 P.M. (prior to Super Bowl). Enjoy!
Android	Because the ban was lifted by a judge, many very bad and dangerous people may be pouring into our country. A terrible decision
Android	What is our country coming to when a judge can halt a Homeland Security travel ban and anyone, even with bad intentions, can come into U.S.?
Android	MAKE AMERICA GREAT AGAIN!
Android	After being forced to apologize for its bad and inaccurate coverage of me after winning the election, the FAKE NEWS _USERNAME_ is still lost!
Android	The opinion of this so-called judge, which essentially takes law-enforcement away from our country, is ridiculous and will be overturned!
Android	Interesting that certain Middle-Eastern countries agree with the ban. They know if certain people are allowed in it's death & destruction!
Android	When a country is no longer able to say who can, and who cannot , come in & out, especially for reasons of safety &.security - big trouble!
Android	Countries charge U.S. companies taxes or tariffs while the U.S. charges them nothing or little.We should charge them SAME as they charge us!
Android	We must keep 'evil' out of our country!
Android	A new radical Islamic terrorist has just attacked in Louvre Museum in Paris. Tourists were locked down. France on edge again. GET SMART U.S.
Android	Professional anarchists, thugs and paid protesters are proving the point of the millions of people who voted to MAKE AMERICA GREAT AGAIN!
Android	Meeting with biggest business leaders this morning. Good jobs are coming back to U.S., health care and tax bills are being crafted NOW!
Android	Thank you to Prime Minister of Australia for telling the truth about our very civil conversation that FAKE NEWS media lied about. Very nice!
Android	Iran is playing with fire - they don't appreciate how 'kind' President Obama was to them. Not me!
iPhone	Thank you, _USERNAME_ We would love to have you! _URL_
Android	Iran was on its last legs and ready to collapse until the U.S. came along and gave it a life-line in the form of the Iran Deal: $150 billion
Android	Iran has been formally PUT ON NOTICE for firing a ballistic missile.Should have been thankful for the terrible deal the U.S. made with them!
Android	Attending Chief Ryan Owens' Dignified Transfer yesterday with my daughter Ivanka was my great honor. To a great and brave man - thank you!
Android	Congratulations to Rex Tillerson on being sworn in as our new Secretary of State. He will be a star!
Android	If U.C. Berkeley does not allow free speech and practices violence on innocent people with a different point of view - NO FEDERAL FUNDS?
Android	Do you believe it? The Obama Administration agreed to take thousands of illegal immigrants from Australia. Why? I will study this dumb deal!
Android	Iran is rapidly taking over more and more of Iraq even after the U.S. has squandered three trillion dollars there. Obvious long ago!
Android	Everybody is arguing whether or not it is a BAN. Call it what you want, it is about keeping bad people (with bad intentions) out of country!
Android	Hope you like my nomination of Judge Neil Gorsuch for the United States Supreme Court. He is a good and brilliant man, respected by all.
iPhone	Join me live from the _USERNAME_ _URL_
Android	Getting ready to deliver a VERY IMPORTANT DECISION! 8:00 P.M.
Android	When will the Democrats give us our Attorney General and rest of Cabinet! They should be ashamed of themselves! No wonder D.C. doesn't work!
Android	Nancy Pelosi and Fake Tears Chuck Schumer held a rally at the steps of The Supreme Court and mic did not work (a mess)-just like Dem party!
iPhone	The American dream is back. We’re going to create an environment for small business like we haven’t had in many, ma… _URL_
iPhone	Where was all the outrage from Democrats and the opposition party (the media) when our jobs were fleeing our country?
Android	I have made my decision on who I will nominate for The United States Supreme Court. It will be announced live on Tuesday at 8:00 P.M. (W.H.)
Android	If the ban were announced with a one week notice, the 'bad' would rush into our country during that week. A lot of bad 'dudes' out there!
Android	There is nothing nice about searching for terrorists before they can enter our country. This was a big part of my campaign. Study the world!
Android	protesters and the tears of Senator Schumer. Secretary Kelly said that all is going well with very few problems. MAKE AMERICA SAFE AGAIN!
Android	Only 109 people out of 325,000 were detained and held for questioning. Big problems at airports were caused by Delta computer outage,.....
iPhone	I will be interviewed by _USERNAME_ on _USERNAME_ tonight at 11pm. Enjoy!
iPhone	Statement Regarding Recent Executive Order Concerning Extreme Vetting: _URL_
Android	...Senators should focus their energies on ISIS, illegal immigration and border security instead of always looking to start World War III.
Android	The joint statement of former presidential candidates John McCain & Lindsey Graham is wrong - they are sadly weak on immigration. The two...
Android	Christians in the Middle-East have been executed in large numbers. We cannot allow this horror to continue!
Android	Our country needs strong borders and extreme vetting, NOW. Look what is happening all over Europe and, indeed, the world - a horrible mess!
Android	Somebody with aptitude and conviction should buy the FAKE NEWS and failing _USERNAME_ and either run it correctly or let it fold with dignity!
Android	...dwindling subscribers and readers.They got me wrong right from the beginning and still have not changed course, and never will. DISHONEST
Android	Thr coverage about me in the _USERNAME_ and the _USERNAME_ gas been so false and angry that the times actually apologized to its.....
Android	The failing _USERNAME_ has been wrong about me from the very beginning. Said I would lose the primaries, then the general election. FAKE NEWS!
iPhone	I promise that our administration will ALWAYS have your back. We will ALWAYS be with you! _URL_
iPhone	Congratulations Secretary Mattis! _URL_
iPhone	Statement on International Holocaust Remembrance Day: _URL_
iPhone	._USERNAME_ Mike Pence will be speaking at today's #MarchForLife -- You have our full support! _URL_
iPhone	The #MarchForLife is so important. To all of you marching --- you have my full support!
Android	Mexico has taken advantage of the U.S. for long enough. Massive trade deficits & little help on the very weak border must change, NOW!
Android	Look forward to seeing final results of VoteStand. Gregg Phillips and crew say at least 3,000,000 votes were illegal. We must do better!
iPhone	Miami-Dade Mayor drops sanctuary policy. Right decision. Strong! _URL_
iPhone	Will be interviewed by _USERNAME_ on _USERNAME_ at 10:00pm tonight. Enjoy!
iPhone	Spoke at the Congressional _USERNAME_ Retreat in Philadelphia, PA. this afternoon w/ _USERNAME_ _USERNAME_ _USERNAME_ Th… _URL_
Android	of jobs and companies lost. If Mexico is unwilling to pay for the badly needed wall, then it would be better to cancel the upcoming meeting.
Android	Ungrateful TRAITOR Chelsea Manning, who should never have been released from prison, is now calling President Obama a weak leader. Terrible!
Android	Interview with David Muir of _USERNAME_ News in 10 minutes. Enjoy!
Android	'_USERNAME_ ._USERNAME_ first _USERNAME_ interview since taking office. Tonight on _USERNAME_ _USERNAME_ tonight. _URL_
iPhone	As your President, I have no higher duty than to protect the lives of the American people. _URL_
iPhone	I will be interviewed by _USERNAME_ tonight at 10 o'clock on _USERNAME_ Will be my first interview from the White House.… _URL_
Android	I will be making my Supreme Court pick on Thursday of next week.Thank you!
Android	even, those registered to vote who are dead (and many for a long time). Depending on results, we will strengthen up voting procedures!
Android	I will be asking for a major investigation into VOTER FRAUD, including those registered to vote in two states, those who are illegal and....
Android	Big day planned on NATIONAL SECURITY tomorrow. Among many other things, we will build the wall!
Android	If Chicago doesn't fix the horrible 'carnage' going on, 228 shootings in 2017 with 42 killings (up 24% from 2016), I will send in the Feds!
Android	Congratulations to _USERNAME_ for being number one in inauguration ratings. They were many times higher than FAKE NEWS _USERNAME_ - public is smart!
iPhone	Great meeting with Ford CEO Mark Fields and General Motors CEO Mary Barra at the _USERNAME_ today. _URL_
iPhone	Signing orders to move forward with the construction of the Keystone XL and Dakota Access pipelines in the Oval Off… _URL_
iPhone	Great meeting with automobile industry leaders at the _USERNAME_ this morning. Together, we will #MAGA! _URL_
Android	Will be meeting at 9:00 with top automobile executives concerning jobs in America. I want new plants to be built here for cars sold here!
Android	Busy week planned with a heavy focus on jobs and national security. Top executives coming in at 9:00 A.M. to talk manufacturing in America.
Android	Peaceful protests are a hallmark of our democracy. Even if I don't always agree, I recognize the rights of people to express their views.
Android	Wow, television ratings just out: 31 million people watched the Inauguration, 11 million more than the very good ratings from 4 years ago!
Android	Watched protests yesterday but was under the impression that we just had an election! Why didn't these people vote? Celebs hurt cause badly.
Android	Had a great meeting at CIA Headquarters yesterday, packed house, paid great respect to Wall, long standing ovations, amazing people. WIN!
Android	A fantastic day and evening in Washington D.C.Thank you to _USERNAME_ and so many other news outlets for the GREAT reviews of the speech!
iPhone	THANK YOU for another wonderful evening in Washington, D.C. TOGETHER, we will MAKE AMERICA GREAT AGAIN🇺🇸 _URL_
iPhone	TO ALL AMERICANS🇺🇸 _URL_
iPhone	So to all Americans, in every city near and far, small and large, from mountain to mountain..._URL_
iPhone	It is time to remember that..._URL_
iPhone	We will follow two simple rules: BUY AMERICAN & HIRE AMERICAN! #InaugurationDay #MAGA🇺🇸
iPhone	We will bring back our jobs. We will bring back our borders. We will bring back our wealth - and we will bring back our dreams!
iPhone	The forgotten men and women of our country will be forgotten no longer. From this moment on, it’s going to be #AmericaFirst🇺🇸
iPhone	What truly matters is not which party controls our government, but whether our government is controlled by the people.
iPhone	power from Washington, D.C. and giving it back to you, the American People. #InaugurationDay
iPhone	Today we are not merely transferring power from one Administration to another, or from one party to another – but we are transferring...
Android	It all begins today! I will see you at 11:00 A.M. for the swearing-in. THE MOVEMENT CONTINUES - THE WORK BEGINS!
iPhone	Thank you for a wonderful evening in Washington, D.C. #Inauguration _URL_
iPhone	Thank you for joining us at the Lincoln Memorial tonight- a very special evening! Together, we are going to MAKE AM… _URL_
iPhone	Join me at 4pm over at the Lincoln Memorial with my family! #Inauguration2017 _URL_
Android	Great Concert at 4:00 P.M. today at Lincoln Memorial. Enjoy!
iPhone	On my way! #Inauguration2017 _URL_
Android	the American people. I have no doubt that we will, together, MAKE AMERICA GREAT AGAIN!
Android	Getting ready to leave for Washington, D.C. The journey begins and I will be working and fighting very hard to make it a great journey for..
Android	'It wasn't Donald Trump that divided this country, this country has been divided for a long time!' Stated today by Reverend Franklin Graham.
iPhone	Thank you to our amazing Wounded Warriors for their service. It was an honor to be with them tonight in D.C.… _URL_
iPhone	Great seeing _USERNAME_ and Kimberly at this evenings VP dinner! #GodBlessTheUSA _URL_
Android	._USERNAME_ was great last night in D.C. playing for 147 Diplomats and Ambassadors from countries around the world. Thanks Alabama!
Android	No wonder the Today Show on biased _USERNAME_ is doing so badly compared to its glorious past. Little credibility!
Android	'Bayer AG has pledged to add U.S. jobs and investments after meeting with President-elect Donald Trump, the latest in a string...' _USERNAME_
Android	to the U.S., but had nothing to do with TRUMP, is more FAKE NEWS. Ask top CEO's of those companies for real facts. Came back because of me!
Android	Totally biased _USERNAME_ went out of its way to say that the big announcement from Ford, G.M., Lockheed & others that jobs are coming back...
Android	Will be interviewed by _USERNAME_ on _USERNAME_ - Enjoy!
Android	'thought it would be hypocritical to attend Bush's swearing-in....he doesn't believe Bush is the true elected president.' Sound familiar! WP
Android	John Lewis said about my inauguration, 'It will be the first one that I've missed.' WRONG (or lie)! He boycotted Bush 43 also because he...
Android	country and with the massive cost reductions I have negotiated on military purchases and more, I believe the people are seeing 'big stuff.'
Android	With all of the jobs I am bringing back into the U.S. (even before taking office), with all of the new auto plants coming back into our.....
Android	The same people who did the phony election polls, and were so wrong, are now doing approval rating polls. They are rigged just like before.
Android	People are pouring into Washington in record numbers. Bikers for Trump are on their way. It will be a great Thursday, Friday and Saturday!
Android	'_USERNAME_ _USERNAME_ _USERNAME_ Trump is great, a woman with real character and class.'
Android	At 9:00 P.M. _USERNAME_ of all places, is doing a Special Report on my daughter, Ivanka. Considering it is CNN, can't imagine it will be great!
Android	Celebrate Martin Luther King Day and all of the many wonderful things that he stood for. Honor him for being the great man that he was!
Android	much worse - just look at Syria (red line), Crimea, Ukraine and the build-up of Russian nukes. Not good! Was this the leaker of Fake News?
Android	._USERNAME_ 'Outgoing CIA Chief, John Brennan, blasts Pres-Elect Trump on Russia threat. Does not fully understand.' Oh really, couldn't do...
Android	._USERNAME_ is bad but Saturday Night Live is the worst of NBC. Not funny, cast is terrible, always a complete hit job. Really bad television!
Android	about that...Those Intelligence chiefs made a mistake here, & when people make mistakes, they should APOLOGIZE.' Media should also apologize
Android	Thank you to Bob Woodward who said, 'That is a garbage document...it never should have been presented...Trump's right to be upset (angry)...
Android	For many years our country has been divided, angry and untrusting. Many say it will never change, the hatred is too deep. IT WILL CHANGE!!!!
Android	will only get higher. Car companies and others, if they want to do business in our country, have to start making things here again. WIN!
Android	The Democrats are most angry that so many Obama Democrats voted for me. With all of the jobs I am bringing back to our Nation, that number..
