iPhone	#Imwithyou _URL_
Android	'_USERNAME_ _USERNAME_ _USERNAME_ _USERNAME_ Saw your interview.You are the best! Great questions, great answers' Lou is great
Android	Crooked Hillary refuses to say that she will be raising taxes beyond belief! She will be a disaster for jobs and the economy!
Android	I am 'the king of debt.'That has been great for me as a businessman, but is bad for the country. I made a fortune off of debt, will fix U.S.
iPhone	Hillary Clinton's open borders immigration policies will drive down wages for all Americans - and make everyone less safe.
Android	Crooked Hillary Clinton is totally unfit to be our president-really bad judgement and a temperament, according to new book, which is a mess!
Android	When I said that if, within the Orlando club, you had some people with guns, I was obviously talking about additional guards or employees
Android	._USERNAME_ We are so proud of you Dustin. Your reaction under pressure was amazing. First of many Majors. You are a true CHAMPION!
Android	'_USERNAME_ Watch out HillaryClinton 👿 Support _USERNAME_ 🇺🇸 🇺🇸 #MakeAmericaGreatAgain 🇺🇸 _URL_
iPhone	Yesterday's failing _USERNAME_ fraudulently shows an empty room prior to my speech, when in fact, it was packed! _URL_
iPhone	How can the NY Times show an empty room hours before my speech even started when they knew it was going to be packed? So totally dishonest!
iPhone	Donald Trump's Speech Is a Game Changer. #Trump2016 _URL_ _URL_
iPhone	See you soon Arizona! #Trump2016 _URL_
iPhone	MAKE AMERICA GREAT AGAIN! MAKE AMERICA SAFE AGAIN! #Trump2016 #AmericaFirst _URL_
iPhone	Thank you Las Vegas, Nevada! #Trump2016 #AmericaFirst _URL_ _URL_
Android	In Las Vegas, getting ready to speak!
iPhone	Join me in Phoenix, Arizona today at 4pm! #Trump2016 #AmericaFirst _URL_ _URL_
iPhone	Thank you Houston, Texas! #AmericaFirst #Trump2016 _URL_
iPhone	Thank you! #AmericaFirst _URL_
iPhone	The convention in Cleveland will be amazing! _URL_
iPhone	Thank you- on my way! _URL_
iPhone	Thank you _USERNAME_ _URL_
iPhone	Join me in Phoenix, Arizona tomorrow at 4pm! #Trump2016 #AmericaFirst _URL_ _URL_
iPhone	THANK YOU! #AmericaFirst _URL_
Android	MAKE AMERICA GREAT AGAIN! MAKE AMERICA SAFE AGAIN!
Android	People very unhappy with Crooked Hillary and Obama on JOBS and SAFETY! Biggest trade deficit in many years! More attacks will follow Orlando
Android	Amazing crowd last night in Dallas - more spirit and passion than ever before. Today, all over the great State of Texas!
iPhone	Thank you Dallas, Texas! _URL_ _URL_
iPhone	Houston, TX: _URL_ Las Vegas, NV _URL_ Phoenix, AZ: _URL_ _URL_
iPhone	Join me in Houston, Texas tomorrow night at 7pm! Tickets: _URL_ _URL_
iPhone	'Donald Trumps Speech Is a Game Changer.' _URL_ _URL_
iPhone	The trade deficit rose to a 7yr high thanks to horrible trade policies Clinton supports. I will fix it fast- JOBS! _URL_
iPhone	McAllen, Texas- 8 miles from U.S. - Mexico border. #Trump2016 Video: _URL_ _URL_
Android	'_USERNAME_ _USERNAME_ is a Common Sense Conservative! President Trump=Competence, Safety, Unity, & US JOBS, JOBS, JOB.
Android	I will be interviewed on _USERNAME_ at 7:00 P.M. _USERNAME_
iPhone	Finally an accurate story from the Washington Post! _URL_
iPhone	Join me in Dallas, Texas on Thursday! #AmericaFirst #Trump2016 _URL_ _URL_
iPhone	Thank you Atlanta, Georgia! Will be back soon! #AmericaFirst _URL_
Android	I will be meeting with the NRA, who has endorsed me, about not allowing people on the terrorist watch list, or the no fly list, to buy guns.
Android	The press is so totally biased that we have no choice but to take our tough but fair and smart message directly to the people!
Android	An: Media fell all over themselves criticizing what DonaldTrump 'may have insinuated about _USERNAME_ But he's right: _URL_
iPhone	TONIGHT! NORTH CAROLINA: _URL_ WEDNESDAY! GEORGIA: _URL_ SATURDAY! NEVADA: _URL_
iPhone	HAPPY 241st BIRTHDAY to the _USERNAME_ THANK YOU! _URL_
Android	AMERICA FIRST!
Android	American must now get very tough, very smart and very vigilant. We cannot admit people into our country without extraordinary screening.
iPhone	Join me in Atlanta on Wednesday- at noon! #Trump2016 Tickets: _URL_ _URL_
iPhone	Crooked Hillary says we must call on Saudi Arabia and other countries to stop funding hate. I am calling on- cont'd: _URL_
iPhone	Saudi Arabia and many of the countries that gave vast amounts of money to the Clinton Foundation- cont'd: _URL_
iPhone	I thought people weren’t celebrating? They were cheering all over, even this savage from Orlando. I was right. _URL_
iPhone	In my speech on protecting America I spoke about a temporary ban, which includes suspending immigration from nations tied to Islamic terror.
iPhone	Based on the incredibly inaccurate coverage and reporting of the record setting Trump campaign, we are hereby: _URL_
iPhone	I am no fan of President Obama, but to show you how dishonest the phony Washington Post is: _URL_
iPhone	TERRORISM, IMMIGRATION, AND NATIONAL SECURITY SPEECH- TRANSCRIPT: _URL_ _URL_
iPhone	Congratulations to the 2016 #StanleyCup Champions, Pittsburgh _USERNAME_
Android	I am watching _USERNAME_ and how fairly they are treating me and my words, and _USERNAME_ and the total distortion of my words and what I am saying
Android	I have been hitting Obama and Crooked Hillary hard on not using the term Radical Islamic Terror. Hillary just broke-said she would now use!
Android	What has happened in Orlando is just the beginning. Our leadership is weak and ineffective. I called it and asked for the ban. Must be tough
Android	'_USERNAME_ _USERNAME_ Please make us safe. We cannot have Hillary as president. We will be in so much trouble.
Android	Reporting that Orlando killer shouted 'Allah hu Akbar!' as he slaughtered clubgoers. 2nd man arrested in LA with rifles near Gay parade.
iPhone	Is President Obama going to finally mention the words radical Islamic terrorism? If he doesn't he should immediately resign in disgrace!
iPhone	Appreciate the congrats for being right on radical Islamic terrorism, I don't want congrats, I want toughness & vigilance. We must be smart!
iPhone	Horrific incident in FL. Praying for all the victims & their families. When will this stop? When will we get tough, smart & vigilant?
iPhone	Clinton made a false ad about me where I was imitating a reporter GROVELING after he changed his story. I would NEVER mock disabled. Shame!
Android	Really bad shooting in Orlando. Police investigating possible terrorism. Many people dead and wounded.
Android	Goofy Elizabeth Warren, sometimes referred to as Pocahontas, pretended to be a Native American in order to advance her career. Very racist!
iPhone	Riley Rone was a great young man. We will miss him dearly. _URL_
iPhone	Join me on Tuesday- in Greensboro, North Carolina! #Trump2016 #AmericaFirst _URL_
iPhone	Thank you Pittsburgh, Pennsylvania! Will be back soon! #AmericaFirst _URL_
iPhone	Thank you to our amazing law enforcement officers! #AmericaFirst _URL_
iPhone	Sad case- _USERNAME_ did article saying I don't pay bills- false, only don't pay when work is shoddy, bad, or not done! They should do same!
iPhone	In Tampa, Florida- thank you to all of our outstanding volunteers who want to #MakeAmericaGreatAgain! _URL_
Android	Don King, and so many other African Americans who know me well and endorsed me, would not have done so if they thought I was a racist!
Android	Mitt Romney had his chance to beat a failed president but he choked like a dog. Now he calls me racist-but I am least racist person there is
iPhone	Thank you Richmond, Virginia! #Trump2016 _URL_
iPhone	Thank you _USERNAME_ Coalition! An honor joining you today- to discuss our shared values. #RTM2016 #Trump2016 _URL_
iPhone	Heading to Richmond, Virginia now. Join me tonight! #Trump2016 Tickets: _URL_
iPhone	#FlashbackFriday #CrookedHillary _URL_
iPhone	2004 VIDEO: Pocahontas describing Crooked Hillary Clinton as a Corporate Donor Puppet. Time for change! #Trump2016 _URL_
Android	Heading to D.C. to speak at Faith and Freedom Coalition and visit OPO.
Android	The great boxing promoter, Don King, just endorsed me. Nice!
iPhone	Join me! 6/10: Richmond, VA - 8pm 6/11: Tampa, FL - 11am 6/11: Pittsburgh, PA - 3pm 6/13: Portsmouth, NH - 2:30pm _URL_
Android	'_USERNAME_ RECORD 14 million primary votes/beat 16 opponents/financed own campaign. You will be a great POTUS & #MakeAmericaGreatAgain'
Android	'_USERNAME_ ._USERNAME_ 'Never before has a president endorsed someone under investigation by _USERNAME_ _URL_
Android	'_USERNAME_ Trump's Historic 13 Million Primary Votes - A Record ... Congratulations _USERNAME_ _URL_
iPhone	Join me! #Trump2016 6/10: Richmond _URL_ 6/11: Tampa _URL_ 6/11: Pittsburgh _URL_
iPhone	How long did it take your staff of 823 people to think that up--and where are your 33,000 emails that you deleted? _URL_
iPhone	A message of condolences and support regarding the terrorist attacks in Tel Aviv: _URL_
Android	Crooked Hillary Clinton will be a disaster on jobs, the economy, trade, healthcare, the military, guns and just about all else. Obama plus!
Android	As expected, the media is very much against me. Their dishonesty is amazing but, just like our big wins in the primaries, we will win!
Android	'_USERNAME_ _USERNAME_ please Mr.Trump make _USERNAME_ your VP. He is a perfect running mate.' He is a great guy!
Android	Bernie Sanders must really dislike Crooked Hillary after the way she played him. Many of his supporters, because of trade, will come to me.
Android	'_USERNAME_ JohnKasich, the VOTERS have spoken.We want _USERNAME_ You AGREED to support NOMINEE. Get on board or leave _USERNAME_
Android	'_USERNAME_ _USERNAME_ You will be the greatest president the world has ever seen' Thanks.
Android	I would have had many millions of votes more than Crooked Hillary Clinton except for the fact that I had 16 opponents, she had one!
Android	'_USERNAME_ _USERNAME_ Congratulations Mr. Trump.' Thank you!
Android	'_USERNAME_ Senator Sanders spent more than _USERNAME_ yet lost.'
iPhone	MAKE AMERICA GREAT AGAIN! #AmericaFirst #Trump2016 _URL_
Android	'_USERNAME_ HISTORIC!! what's historic is OUR national debt, record unemployment, &pocketbook crisis!THE PEOPLE NEED TRUMP2 make USA RICH!'
Android	'_USERNAME_ _USERNAME_ Great speach!!!!!!!' Thanks!
Android	'_USERNAME_ . _USERNAME_ doing _USERNAME_ on _USERNAME_ is awesome. 'Number one presidency of all time'
Android	'_USERNAME_ Top RINO hack for MSNBC Joey Scarborough on the air and calling the next President Trump a racist and bigot. Shame on you'
Android	Nobody is watching _USERNAME_ anymore. Gone off the deep end - bad ratings. You won't believe what I am watching now!
Android	'_USERNAME_ _USERNAME_ fans, greatest way to get even with her Highness - vote for _USERNAME_ at least you'll have a job.
Android	Thank you to all for your wonderful comments on my speech. I could feel the electricity in thr air. Great reviews - most votes ever recieved
Android	'_USERNAME_ Gee ... Does this make _USERNAME_ right one more time? _URL_
Android	'_USERNAME_ Standing by _USERNAME_ all the way to the White House! _URL_
iPhone	Thank you California! #Trump2016 _URL_ _URL_
iPhone	Thank you New Mexico! #Trump2016 _URL_ _URL_
iPhone	Thank you South Dakota! #Trump2016 _URL_ _URL_
iPhone	Thank you New Jersey! #Trump2016 _URL_ _URL_
iPhone	Thank you Montana! #Trump2016 _URL_ _URL_
Android	I will be interviewed tonight on _USERNAME_ - Enjoy! 10:00 P.M.
iPhone	Thank you! Together we will #MakeAmericaGreatAgain! _URL_
Android	In just out book, Secret Service Agent Gary Byrne doesn't believe that Crooked Hillary has the temperament or integrity to be the president!
Android	A former Secret Service Agent for President Clinton excoriates Crooked Hillary describing her as ERRATIC & VIOLENT. Bad temperament for pres
iPhone	Remembering the fallen heroes on #DDay - June 6, 1944. _URL_
iPhone	I am getting bad marks from certain pundits because I have a small campaign staff. But small is good, flexible, save money and number one!
Android	A massive blow to Obama's message - only 38,000 new jobs for month in just issued jobs report. That's REALLY bad!
Android	Crooked Hillary is being badly criticized (for a Wall Street paid for ad) by PolitiFact for a false ad on me on women. She is a total fraud!
Android	Crooked Hillary Clinton has not held a news conference in more than 7 months. Her record is so bad she is unable to answer tough questions!
Android	Just like I have been able to spend far less money than others on the campaign and finish #1, so too should our country. We can be great!
Android	People like _USERNAME_ report on my campaign, but have zero access. They say what they want without any knowledge.True of so much of media!
Android	Hillary Clinton is unfit to be president. She has bad judgement, poor leadership skills and a very bad and destructive track record. Change!
Android	I am watching _USERNAME_ very little lately because they are so biased against me. Shows are predictable garbage! CNN and MSM is one big lie!
Android	The Clinton News Network, sometimes referred to as _USERNAME_ is getting more and more biased.They act so indignant-hear them behind closed doors
iPhone	Thank you Attorney General Gonzales, so many people feel this way. _URL_
Android	We just had the worst jobs report since 2010.
Android	The Mayor of San Jose did a terrible job of ordering the protection of innocent people. The thugs were lucky supporters remained peaceful!
Android	Many of the thugs that attacked the peaceful Trump supporters in San Jose were illegals. They burned the American flag and laughed at police
Android	'_USERNAME_ Thank You Mr. Trump for Standing up for Our Country! #VoteTrump2016 JOIN ME ON THE #TrumpTrain🚂 _URL_
Android	'_USERNAME_ Here’s The HILLARY UNIVERSITY Scandal No One In The Media Is Talking About _URL_ _USERNAME_
Android	Muhammad Ali is dead at 74! A truly great champion and a wonderful guy. He will be missed by all!
iPhone	Thank you Redding, California! #MakeAmericaGreatAgain #CAPrimary _URL_
iPhone	Great evening in San Jose other than the thugs. My supporters are far tougher if they want to be, but fortunately they are not hostile.
iPhone	So much interest in my visit to Scotland! I greatly look forward to attending the opening event _USERNAME_ taking place on June 24th.
iPhone	'I'm a former chief of police in a border town. I'm Hispanic, I'm proud to be Hispanic and I'm 100% behind Trump.' _URL_
Android	In Crooked Hillary's telepromter speech yesterday, she made up things that I said or believe but have no basis in fact. Not honest!
Android	I don't watch or do _USERNAME_ anymore. Small audience, low ratings! I hear Mika has gone wild with hate. Joe is Joe. They lost their way!
Android	Rally last night in San Jose was great. Tremendous love and enthusiasm in the hall. Big crowd. Outside, small group of thugs burned Am flag!
Android	'_USERNAME_ Yes! Hubby and I voted 4 _USERNAME_ already! _URL_ Thank you.
Android	'_USERNAME_ I think the first female president of the USA will be _USERNAME_ a beautiful intelligent young genuine successful lady!'
Android	'_USERNAME_ This is rich coming from her. She tweeted you will be president! #Women4Ttump #Trump2016 _URL_
Android	'_USERNAME_ Clinton says Trump is dangerous. Who's the one who killed 4 Americans in Benghazi? _URL_
Android	'_USERNAME_ _USERNAME_ _USERNAME_ Looks like several legal Hispanics supporting Trump! They know he will be good for them too.'
iPhone	Then, on June 25th- back to the USA to MAKE AMERICA GREAT AGAIN!
iPhone	After _USERNAME_ I will visit _USERNAME_ in Ireland, the magnificent resort fronting on the Atlantic Ocean.
iPhone	After _USERNAME_ I will be visiting Aberdeen, the oil capital of Europe, to see my great club, _USERNAME_
iPhone	On June 22- I will be going to Scotland to celebrate the opening of the newly renovated _USERNAME_ Resort, the worlds best.
iPhone	Join me in Redding, California- tomorrow at 1:00pm. #Trump2016 Tickets: _URL_
iPhone	._USERNAME_ Thank you for the nice piece in _USERNAME_ / _USERNAME_ Keep up the great work! _URL_
Android	'_USERNAME_ _USERNAME_ Only Trump can save America. Right leader at the right time.' THANK YOU!
Android	'_USERNAME_ _USERNAME_ she's a criminal and you're the only person that can stop her.'
Android	'_USERNAME_ THIS IS _USERNAME_ LEGACY! AN ABSOLUTE DISASTER!!! WE NEED _USERNAME_ NOW!! #MAGA #TRUMP2016 _URL_
Android	A 60% increase in Texas Blue Cross/Blue Shield through ObamaCare. I told you so, there is panic and anger as healthcare costs explode!
iPhone	So great to have the endorsement and support of Paul Ryan. We will both be working very hard to Make America Great Again!
Android	Bad performance by Crooked Hillary Clinton! Reading poorly from the telepromter! She doesn't even look presidential!
Android	Crooked Hillary no longer has credibility - too much failure in office. People will not allow another four years of incompetence!
Android	Crooked Hillary Clinton, who I would love to call Lyin' Hillary, is getting ready to totally misrepresent my foreign policy positions.
Android	After the litigation is disposed of and the case won, I have instructed my execs to open Trump U(?), so much interest in it! I will be pres.
Android	Even though I have a very biased and unfair judge in the Trump U civil case in San Diego, I have thousands of great reviews & will win case!
Android	With all of the Crooked Hillary Clinton's foreign policy experience, she has made so many mistakes - and I mean real monsters! No more HRC.
iPhone	Join me in San Jose, California- tonight! #MakeAmericaGreatAgain #Trump2016 Tickets: _URL_ _URL_
Android	Wow, USA Today did todays cover story on my record in lawsuits. Verdict: 450 wins, 38 losses. Isn't that what you want for your president?
Android	Do you ever notice that _USERNAME_ gives me very little proper representation on my policies. Just watched-nobody knew anything about my foreign P
Android	Bernie Sanders was right when he said that Crooked Hillary Clinton was not qualified to be president because she suffers from BAD judgement!
Android	Crooked Hillary Clinton has zero natural talent - she should not be president. Her temperament is bad and her decision making ability-zilch!
Android	'_USERNAME_ _USERNAME_ I already voted for you! My wife did as well! I represent #Teachers4Trump! We represent #CA4Trump! #NeverDems
iPhone	Thank you Sacramento, California! #MakeAmericaGreatAgain _URL_
iPhone	Same failing _USERNAME_ 'reporter' who wrote discredited women's story last week wrote another terrible story on me today- will never learn!
Android	Crooked Hillary Clinton is a fraud who has put the public and country at risk by her illegal and very stupid use of e-mails. Many missing!
iPhone	Join me in San Jose, California- tomorrow evening at 7pm! #MakeAmericaGreatAgain #Trump2016 _URL_ _URL_
Android	So I raised/gave $5,600,000 for the veterans and the media makes me look bad! They do anything to belittle - totally biased.
iPhone	Congratulations to _USERNAME_ on his tremendous increase in television ratings. Speaking of ratings- I will be on his show tonight @ 10pE.
iPhone	I am getting great credit for my press conference today. Crooked Hillary should be admonished for not having a press conference in 179 days.
iPhone	Katie Couric, the third rate reporter, who has been largely forgotten, should be ashamed of herself for the fraudulent editing of her doc.
iPhone	I will be interviewed on _USERNAME_ tonight at 10pmE on _USERNAME_ Enjoy!
iPhone	Join me in Sacramento, California-tomorrow evening @ 7pm! #Trump2016 _URL_ _URL_
Android	So many veterans groups are beyond happy with all of the money I raised/gave! It was my great honor - they do an amazing job.
Android	Just finished a press conference in Trump Tower wherein I gave information on which VETERANS groups got the $5,600,000 that I raised/gave!
Android	I have raised/given a tremendous amount of money to our great VETERANS, and have got nothing but bad publicity for doing so. Watch!
Android	So many great things happening - new poll numbers looking good! News conference at 11:00 A.M. today, Trump Tower!
Android	I have a judge in the Trump University civil case, Gonzalo Curiel (San Diego), who is very unfair. An Obama pick. Totally biased-hates Trump
Android	I hope everyone had a great Memorial Day!
Android	I would have had millions of votes more in the primaries (than Crooked Hillary) if I only had one opponent, instead of sixteen. Broke record
Android	Have a great Memorial Day and remember that we will soon MAKE AMERICA GREAT AGAIN!
Android	'_USERNAME_ Trump rallies veterans at annual Rolling Thunder Gathering _URL_ _URL_
Android	'_USERNAME_ how many of donald's rolling thunder brigade will sign up and go to war for him in the middle east.'
Android	'_USERNAME_ Trump Supports Rolling Thunder Rally #TRUMP STRONG _URL_ So true, and remember the M.I.A.'s!
Android	'_USERNAME_ Donald Trump and Bikers Share Affection at Rolling Thunder Rally _URL_ A great day in D.C.!
Android	'_USERNAME_ #Trump2016 'Illegals are taken care of better than our veterans.' _URL_ _URL_
Android	The endorsement of me by the 16,500 Border Patrol Agents was the first time that they ever endorsed a presidential candidate. Nice!
Android	In getting the endorsement of the 16,500 Border Patrol Agents (thank you), the statement was made that the WALL was very necessary!
Android	Obama says a WALL at our southern border won't enhance our security (wrong) and yet he now wants to build a much bigger wall (fence) at W.H.
iPhone	If dummy Bill Kristol actually does get a spoiler to run as an Independent, say good bye to the Supreme Court!
Android	The Republican Party has to be smart & strong if it wants to win in November. Can't allow lightweights to set up a spoiler Indie candidate!
iPhone	Good news is that my campaign has perhaps more cash than any campaign in the history of politics- b/c I stand 100% behind everything we do.
Android	Heading to D.C. to see and hear ROLLING THUNDER. Amazing people that LOVE OUR COUNTRY. Great spirit!
Android	Honor Memorial Day by thinking of and respecting all of the great men and women that gave their lives for us and our country! We love them.
iPhone	Does President Obama ever discuss the sneak attack on Pearl Harbor while he's in Japan? Thousands of American lives lost. #MDW
iPhone	Don't believe the biased and phony media quoting people who work for my campaign. The only quote that matters is a quote from me!
iPhone	I am always on the front page of the failing _USERNAME_ but when I won the GOP nomination, I'm in the back of the paper. Very dishonest!
iPhone	The media is on a new phony kick about my management style. I spend much less money & get much better results! What we need as Prez!
iPhone	The failing _USERNAME_ wrote a story about my management style & that I don't have many people. I have 73, Hillary has 800- & I'm beating her.
Android	I (we) broke the all-time record for most votes gotten in a Republican Primary - by a lot - and with many states left to go! Thank you.
Android	The U.S. has 69 treaties with other countries where we would have to defend them and their borders. How nice, but what do we get? NOT ENOUGH
iPhone	Great rally in Fresno, California- great crowd! Thank you! #Trump2016 _URL_
iPhone	Obama administration fails to screen Syrian refugees' social media accounts: _URL_
iPhone	._USERNAME_ Fantastic job on handling the thugs who tried to disrupt our very peaceful and well attended rally. Greatly appreciated!
iPhone	Thank you _USERNAME_ many friends just told me you gave a very kind shoutout at MSG. Appreciate it- love your music!
Android	I am on _USERNAME_ tonight, a big special. _USERNAME_ at 8:00 P.M. ENJOY!
iPhone	Bill O'Reilly doing a major special on _USERNAME_ tonight- _USERNAME_ at 8pmE. Watch it, should be good! #Trump2016
iPhone	AN AMERICA FIRST ENERGY PLAN #MakeAmericaGreatAgain #Trump2016 _URL_ _URL_
Android	Poll data shows that _USERNAME_ does by far the best in holding onto his Senate seat in Florida. Important to keep the MAJORITY. Run Marco!
iPhone	My wife _USERNAME_ and my children will be featured on _USERNAME_ with _USERNAME_ 7pmE. Enjoy! #MeetTheTrumps #Trump2016
iPhone	Celebrating 1237! #Trump2016 _URL_
iPhone	Thank you! #Trump2016 _URL_
iPhone	I find it offensive that Goofy Elizabeth Warren, sometimes referred to as Pocahontas, pretended to be Native American to get in Harvard.
iPhone	Thank you Mr. & Mrs. _USERNAME_ for the wonderful and magical evening last night. It will not be forgotten. #Trump2016
iPhone	._USERNAME_ just watched you on _USERNAME_ thank you!
Android	The Inspector General's report on Crooked Hillary Clinton is a disaster. Such bad judgement and temperament cannot be allowed in the W.H.
iPhone	Thank you Anaheim, California! #Trump2016 _URL_
iPhone	Thank you Washington! Honored to say, on behalf of our great movement, we have broken the all time record for votes in GOP primary history.
Android	The protesters in New Mexico were thugs who were flying the Mexican flag. The rally inside was big and beautiful, but outside, criminals!
Android	Goofy Senator Elizabeth Warren _USERNAME_ has done less in the U.S. Senate than practically any other senator. All talk, no action!
Android	_USERNAME_ Goofy Elizabeth Warren, sometimes known as Pocahontas, bought foreclosed housing and made a quick killing. Total hypocrite!
Android	'_USERNAME_ Washington, BIG Thank You for supporting Trump! We are all going to help Trump Make America Great Again! Trump2016!'
Android	'_USERNAME_ _USERNAME_ high energy!'
Android	'_USERNAME_ Great speech tonight Mr.Trump! Good Luck in California! Thank you.
Android	'_USERNAME_ _USERNAME_ congratulations from India'
Android	'_USERNAME_ _USERNAME_ UP TO 8.4 MILLION FOLLOWERS. CAN'T STOP THE #TrumpTrain 🚂 #MakeAmericaGreatAgain'
Android	'_USERNAME_ _USERNAME_ #TrumpTrain'
Android	'_USERNAME_ _USERNAME_ Great job! Make America Great Again!'
